Report Type,Program,Activity,Latitude,Longitude,Activity Date,Submission Date,Start Time,End Time,Length hours,Length minutes,Journal Entry,Medical Consults,Nurse Practitioner Consults,Nursing/Paramedic Consults,Conversations about health education,Allied Health,Referrals (Formal and informal),Patient Conversations,Service provider conversations,Mental health,Suicide prevention/planning,Substance use,Medication education,Patients turned away,Telehealth consults that happened at Clinic,Patient Feedback Received ,Service Provider Feedback Received ,Complete debrief,Complete all progress notes,Enter all doctor and nurse practitioner appointments,Wipe down clinic area,Shift Safety
Default,Brisbane,Beddown Event Brisbane CBD,-27.468969,153.023499,10/1/2019,10/1/2019,8:20 PM,10:15 PM,1:55,115,First shift at Beddown!! Great space. Feedback from a patient saying he knew about Sunny Street from LinkedIn - homeless! Setting up near the dentist is better and in the thoroughfare near toilets. Brilliant!! ,0,0,5,0,0,0,15,0,0,0,0,0,0,0,,,Yes,Yes,No,Yes,5
Default,Brisbane,Beddown Event Brisbane CBD,-27.468969,153.023499,10/2/2019,10/3/2019,8:30 PM,10:50 PM,2:20,140,Quiet night...2nd of Beddown. Starting to establish trust. Linking one chap into methodone program before jail. ,2,0,4,0,0,7,9,0,0,0,0,0,0,0,,,Yes,Yes,Yes,Yes,5
Default,Brisbane,Beddown Event Brisbane CBD,-27.468969,153.023499,10/5/2019,10/6/2019,8:00 PM,10:15 PM,2:15,135,Very quiet Saturday night. Difficult to engage people in the transition from registering to showers and then bed. Had 2 Doctors on shift - Orthopaedic Surgeon and a Hematologist and a Nursing Director. New Doctors are wonderful and invested. Discussions with Norm re future presence. Left a Nursing kit there. ,0,0,2,0,0,0,5,0,0,0,0,0,0,0,,,Yes,Yes,No,Yes,5
Default,Brisbane,Beddown Event Brisbane CBD,-27.468969,153.023499,10/8/2019,10/8/2019,9:00 PM,10:15 PM,1:15,75,"Better night tonight with food vans and tables out for people to sit around. Played a game of Connect 4, listened to a fellow play and sing on an out of tune guitar, liaised with the dental surgeons amongst the bathroom lockers. Had referred a lad here at Beddown from the Red Cross Night Cafe. Good chats. ",0,0,2,0,0,0,11,0,0,0,0,0,0,0,,,Yes,Yes,No,Yes,5
Default,Brisbane,Beddown Event Brisbane CBD,-27.468969,153.023499,10/9/2019,10/10/2019,9:20 PM,10:15 PM,0:55,55,Played uno with patrons - great wY for people to settle before sleeping. CEO and QLD Manager of Secure Parking and National Seven news present. Interviewed Sonia and will air Thurs 10th Oct. ,0,0,2,0,0,0,12,0,0,0,0,0,0,0,,,Yes,Yes,No,Yes,5
Covid Clinic,COVID19 Respiratory Clinics,Covid Respiratory Clinic,-26.3974264,153.0414757,1/10/2021,1/10/2021,8:30 AM,5:00 PM,8:30,510,,0,0,0,0,0,0,0,0,0,0,0,0,0,0,0,0,0,0,0,0,0
Covid Clinic,COVID19 Respiratory Clinics,Covid Respiratory Clinic,-26.3974264,153.0414757,1/10/2021,1/14/2021,8:30 AM,5:00 PM,8:30,510,,0,0,0,0,0,0,0,0,0,0,0,0,0,0,0,0,0,0,0,0,0
Covid Clinic,COVID19 Respiratory Clinics,Covid Respiratory Clinic,-26.3974264,153.0414757,1/11/2021,1/14/2021,9:00 AM,5:00 PM,8:00,480,,0,0,0,0,0,0,0,0,0,0,0,0,0,0,0,0,0,0,0,0,0
Covid Clinic,COVID19 Respiratory Clinics,Covid Respiratory Clinic,-26.3974264,153.0414757,1/11/2021,1/11/2021,9:00 AM,5:00 PM,8:00,480,,0,0,0,0,0,0,0,0,0,0,0,0,0,0,0,0,0,0,0,0,0
Covid Clinic,COVID19 Respiratory Clinics,Covid Respiratory Clinic,-26.3974264,153.0414757,1/12/2021,1/12/2021,9:00 AM,4:00 PM,7:00,420,,0,0,0,0,0,0,0,0,0,0,0,0,0,0,0,0,0,0,0,0,0
Covid Clinic,COVID19 Respiratory Clinics,Covid Respiratory Clinic,-26.3974264,153.0414757,1/12/2021,1/14/2021,9:00 AM,4:00 PM,7:00,420,,0,0,0,0,0,0,0,0,0,0,0,0,0,0,0,0,0,0,0,0,0
Covid Clinic,COVID19 Respiratory Clinics,Covid Respiratory Clinic,-26.3974264,153.0414757,1/16/2021,1/17/2021,9:00 AM,5:00 PM,8:00,480,,0,0,0,0,0,0,0,0,0,0,0,0,0,0,0,0,0,0,0,0,0
Covid Clinic,COVID19 Respiratory Clinics,Covid Respiratory Clinic,-26.3974264,153.0414757,2/16/2021,2/16/2021,8:30 AM,5:00 PM,8:30,510,Patients were happy with care. ,0,0,0,0,0,0,0,0,0,0,0,0,0,0,0,0,0,0,0,0,0
Default,Sunshine Coast,Gympie ,-26.1834951,152.6464156,8/16/2019,8/16/2019,7:30 AM,10:25 AM,2:55,175,,10,0,3,0,0,3,1,0,0,0,0,0,0,0,,,No,Yes,Yes,Yes,5
Default,Sunshine Coast,Gympie ,-26.1834951,152.6464156,8/23/2019,8/23/2019,7:30 AM,10:08 AM,2:38,158,Left nursing kit and laptop in place. Rearranged consult area nurses station to enhance privacy and added musical ambience. Diagnosed a skin cancer. Received positive feedback re music ,7,0,8,0,0,2,25,0,0,0,0,0,0,0,,,Yes,No,Yes,Yes,5
Default,Sunshine Coast,Gympie ,-26.1834951,152.6464156,8/30/2019,8/30/2019,7:30 AM,10:39 AM,3:09,189,Informed patients nova away for 1 month. Very positive clinic! Patients getting on top of some issues and kicking goals! One patient said 'Thank you for listening!' also had another doctor and a support on crew,9,0,9,0,0,14,21,0,0,0,0,0,0,0,,,No,Yes,Yes,Yes,5
Default,Sunshine Coast,Gympie ,-26.1834951,152.6464156,9/13/2019,9/14/2019,7:30 AM,9:15 AM,1:45,105,,5,0,0,0,0,1,4,0,0,0,0,0,0,0,,,Yes,Yes,No,Yes,5
Default,Sunshine Coast,Gympie ,-26.1834951,152.6464156,10/11/2019,10/14/2019,7:30 AM,9:00 AM,1:30,90,,0,0,5,0,0,0,0,0,0,0,0,0,0,0,,,Yes,Yes,No,Yes,5
Default,Sunshine Coast,Gympie ,-26.1834951,152.6464156,10/18/2019,10/18/2019,7:30 AM,9:00 AM,1:30,90,"No dongle for WiFi used hotspot
Kelly white shirt Med please.
Baby gifts given to Dee(mum)",0,0,3,0,0,0,5,0,0,0,0,0,0,0,,,Yes,No,Yes,No,0
Default,Sunshine Coast,Gympie ,-26.1834951,152.6464156,10/25/2019,10/27/2019,7:30 AM,9:00 AM,1:30,90,Very quiet morning. No one really at the Salvos breakfast either. ,0,0,0,0,0,0,2,0,0,0,0,0,0,0,,,Yes,Yes,Yes,Yes,5
Default,Sunshine Coast,Gympie ,-26.1834951,152.6464156,11/1/2019,11/1/2019,7:30 AM,8:30 AM,1:00,60,Unable to access BP account disabled ,0,0,2,0,0,0,2,0,0,2,0,0,0,0,,,Yes,Yes,Yes,Yes,5
Default,Sunshine Coast,Gympie ,-26.1834951,152.6464156,11/29/2019,11/29/2019,7:30 AM,9:00 AM,1:30,90,Quiet for the entire hub today. Internet sorted!,0,0,1,0,0,0,4,2,1,0,1,0,0,0,,,Yes,Yes,Yes,No,5
Default,Sunshine Coast,Gympie ,-26.1834951,152.6464156,5/22/2020,5/25/2020,8:00 AM,1:00 PM,5:00,300,"Clair and Brian from the salvation army are retiring in 7 weeks. 
Nova and I walked through parks and areas randomly walking up to people and asking them if they wanted free flu jabs! We took Queenie. 
Incredible, incredible day hearing people's stories.",10,0,15,15,0,3,100,10,10,0,2,20,0,0,Many patients (around 5) stated they REALLY appreciated the outreach approach with the flu vaxs. One man walked up to us and gave us the thumbs up and told us as was an amazing idea because giving care to people who were homeless was a wonderful thing to do since no one wants to do it. Another woman congratulated us on starting up the service.,One person from the salvation army was thankful to see ss. ,Yes,Yes,Yes,Yes,5
Default,Sunshine Coast,Gympie ,-26.1834951,152.6464156,5/29/2020,6/1/2020,7:29 AM,2:01 PM,6:32,392,"The team set up outside of public toilets for greater community impact and engagement. This was a winning strategy!
The signs out, only brought 5 people out of the 2 road trip days to the clinics. The rest were opportunistic. 
St Vinnies was disorganised St an operational level. 
Flu vax surveys completed.
Well worth our time! ",0,0,35,50,0,5,200,15,10,0,5,28,0,0,"Patients stating the outreach to do flu vaxs was so helpful and practical. Also that the approach allowed people who normally would not get a vaccination, to receive one. ",Salvation army and St Vinnies stated grateful for the outreach service ,Yes,Yes,Yes,Yes,5
Default,Fraser Coast ,Hervey Bay Neighbourhood/ Community Centre ,-25.2818438,152.8350298,11/11/2020,12/2/2020,4:00 PM,5:37 PM,1:37,97,Great day! Need to smooth out our process but we will get there :) ,3,0,3,5,0,0,4,1,1,0,1,0,0,0,Great that we are back each week. ,One personfrom APM would like to link in with us.,Yes,Yes,Yes,Yes,5
Default,Fraser Coast ,Hervey Bay Neighbourhood/ Community Centre ,-25.2818438,152.8350298,11/18/2020,11/19/2020,4:00 PM,6:00 PM,2:00,120,"Lynda had trouble with the computer, pt notes in notebook. Lynda needs to be shown how to do a shift report.",0,0,3,3,0,1,12,2,3,0,0,1,0,0,0,0,Yes,No,No,No,5
Default,Fraser Coast ,Hervey Bay Neighbourhood/ Community Centre ,-25.2818438,152.8350298,11/25/2020,1/25/2021,4:00 PM,6:00 PM,2:00,120,,3,0,5,9,0,3,3,2,6,0,4,7,0,0,0,,Yes,Yes,Yes,Yes,5
Default,Fraser Coast ,Hervey Bay Neighbourhood/ Community Centre ,-25.2818438,152.8350298,12/2/2020,1/25/2021,4:00 PM,6:00 PM,2:00,120,,3,0,6,8,0,2,4,2,6,0,4,8,0,0,0,0,Yes,Yes,Yes,No,5
Default,Fraser Coast ,Hervey Bay Neighbourhood/ Community Centre ,-25.2818438,152.8350298,12/9/2020,12/9/2020,4:00 PM,6:00 PM,2:00,120,,1,0,2,4,0,0,16,10,2,0,0,0,0,2,N/A,N/A,Yes,Yes,Yes,Yes,5
Default,Fraser Coast ,Hervey Bay Neighbourhood/ Community Centre ,-25.2818438,152.8350298,12/16/2020,12/16/2020,4:00 PM,5:30 PM,1:30,90,A great day for networking! ,0,0,0,4,0,0,26,5,0,0,0,0,0,0,Patient who could not wait for Dr Nova last week advised she would not be back. ,,Yes,Yes,Yes,Yes,5
Default,Fraser Coast ,Hervey Bay Neighbourhood/ Community Centre ,-25.2818438,152.8350298,12/23/2020,12/23/2020,4:00 PM,5:22 PM,1:22,82,,0,0,0,5,0,1,15,5,1,1,1,0,0,0,N/A,,Yes,Yes,Yes,Yes,5
Default,Fraser Coast ,Hervey Bay Neighbourhood/ Community Centre ,-25.2818438,152.8350298,2/10/2021,2/10/2021,4:00 PM,6:00 PM,2:00,120,,0,0,0,3,0,1,11,6,2,1,1,0,0,0,N/A,N/A,Yes,Yes,Yes,Yes,5
Default,Fraser Coast ,Hervey Bay Neighbourhood/ Community Centre ,-25.2818438,152.8350298,2/24/2021,2/24/2021,4:15 PM,5:32 PM,1:17,77,,0,0,0,1,0,0,12,4,1,0,0,0,0,0,N/A,,Yes,Yes,Yes,Yes,4
Default,Fraser Coast ,Hervey Bay Neighbourhood/ Community Centre ,-25.2818438,152.8350298,3/3/2021,3/3/2021,4:00 PM,5:30 PM,1:30,90,,0,0,0,2,0,0,9,5,0,0,0,0,0,0,N/A,,Yes,Yes,Yes,Yes,5
Default,Fraser Coast ,Hervey Bay Neighbourhood/ Community Centre ,-25.2818438,152.8350298,3/10/2021,3/10/2021,4:00 PM,5:29 PM,1:29,89,Lynda away until 10/4/2021,0,0,0,2,0,0,5,3,0,0,0,0,0,0,N/A,"Thankful we are here. Sorry that consumers are coming before we start. From 1/4/2021 changing the way they run the meals. Strict with times 4pm-6pm. Police, Centrelink and other agencies will be here as Job seeker finishes so will be linking new people. ",Yes,Yes,Yes,Yes,5
Default,Fraser Coast ,Hervey Bay Neighbourhood/ Community Centre ,-25.2818438,152.8350298,3/17/2021,3/17/2021,4:00 PM,5:30 PM,1:30,90,,0,0,0,2,0,0,7,5,1,0,0,0,0,0,Nil,Nil,Yes,Yes,Yes,Yes,4
Default,Fraser Coast ,Hervey Bay Neighbourhood/ Community Centre ,-25.2818438,152.8350298,3/24/2021,3/25/2021,4:00 PM,6:00 PM,2:00,120,NO staff to cover shift,0,0,0,0,0,0,0,0,0,0,0,0,0,0,0,0,No,No,No,No,5
Default,Fraser Coast ,Hervey Bay Neighbourhood/ Community Centre ,-25.2818438,152.8350298,4/14/2021,4/19/2021,4:00 PM,5:30 PM,1:30,90,Dr. Chris and his nurse present.,0,0,0,24,0,0,24,15,0,0,0,0,0,0,0,0,Yes,No,No,No,5
Default,Sunshine Coast,Maroochy Neighbourhood Centre,-26.6569507,153.0987594,8/13/2019,8/14/2019,4:30 PM,7:00 PM,2:30,150,"new with Queenie out back next to OS worked well
need to teach team about F8 messaging",10,0,5,0,0,2,4,0,0,0,0,0,0,0,,,Yes,Yes,Yes,Yes,4
Default,Sunshine Coast,Maroochy Neighbourhood Centre,-26.6569507,153.0987594,8/20/2019,8/20/2019,4:30 PM,7:27 PM,2:57,177,Patients frustrated with weight times and people jumping queue. May need to organize ticket system to allow fairness. ,10,0,11,0,0,0,15,0,0,0,0,0,0,0,,,No,Yes,Yes,Yes,5
Default,Sunshine Coast,Maroochy Neighbourhood Centre,-26.6569507,153.0987594,8/22/2019,8/22/2019,4:30 PM,6:24 PM,1:54,114,"Stock needed - dressing trays, blueys, glucometer, saline . ",0,0,11,0,0,0,2,0,0,0,0,0,0,0,,,Yes,Yes,No,Yes,5
Default,Sunshine Coast,Maroochy Neighbourhood Centre,-26.6569507,153.0987594,8/27/2019,8/27/2019,4:29 PM,6:30 PM,2:01,121,List for GP to complete,0,0,12,0,0,0,6,0,0,0,0,0,0,0,,,Yes,Yes,No,Yes,5
Default,Sunshine Coast,Maroochy Neighbourhood Centre,-26.6569507,153.0987594,8/29/2019,8/29/2019,4:24 PM,6:25 PM,2:01,121,Quiet clinic tonight. Nurses kit needs dressing packs ,0,0,4,0,0,0,4,0,0,0,0,0,0,0,,,Yes,Yes,No,No,5
Default,Sunshine Coast,Maroochy Neighbourhood Centre,-26.6569507,153.0987594,9/3/2019,9/3/2019,4:24 PM,6:27 PM,2:03,123,"Client upset about Nova not being here.
Podiatrist commenced tonight for MNC",0,0,5,0,0,0,6,0,0,0,0,0,0,0,,,Yes,Yes,No,Yes,5
Default,Sunshine Coast,Maroochy Neighbourhood Centre,-26.6569507,153.0987594,9/5/2019,9/5/2019,4:25 PM,6:25 PM,2:00,120,,0,0,3,0,0,1,24,0,0,0,0,0,0,0,,,Yes,No,No,No,5
Default,Sunshine Coast,Maroochy Neighbourhood Centre,-26.6569507,153.0987594,9/10/2019,9/10/2019,4:30 PM,6:30 PM,2:00,120,,0,2,6,0,0,5,19,0,0,0,0,0,0,0,,,Yes,Yes,Yes,Yes,5
Default,Sunshine Coast,Maroochy Neighbourhood Centre,-26.6569507,153.0987594,9/12/2019,9/12/2019,4:30 PM,6:44 PM,2:14,134,"3 new patients tonight. IT issues, Noytech notified, one laptop sorted. Problems connecting to WiFi using new Telstra dongle, staff using their phones for hotspot ",0,2,4,0,0,2,18,0,0,0,0,0,0,0,,,Yes,Yes,No,No,5
Default,Sunshine Coast,Maroochy Neighbourhood Centre,-26.6569507,153.0987594,9/17/2019,9/17/2019,4:03 PM,6:44 PM,2:41,161,Kit needs gauze squares & thanks to Nat laptops up & running. T shirt for Andrea L,0,0,6,0,0,4,29,0,0,0,0,0,0,0,,,Yes,No,No,Yes,5
Default,Sunshine Coast,Maroochy Neighbourhood Centre,-26.6569507,153.0987594,9/19/2019,10/7/2019,4:30 PM,6:30 PM,2:00,120,,0,0,4,0,0,5,19,0,0,0,0,0,0,0,,,Yes,Yes,No,Yes,5
Default,Sunshine Coast,Maroochy Neighbourhood Centre,-26.6569507,153.0987594,9/24/2019,9/24/2019,4:31 PM,6:31 PM,2:00,120,,4,2,2,0,0,3,11,0,0,0,0,0,0,0,,,Yes,Yes,Yes,Yes,5
Default,Sunshine Coast,Maroochy Neighbourhood Centre,-26.6569507,153.0987594,9/26/2019,9/26/2019,4:30 PM,6:30 PM,2:00,120,Nursing kit needs some more gauze restocked please,0,1,2,0,0,0,16,0,0,0,0,0,0,0,,,Yes,Yes,Yes,Yes,5
Default,Sunshine Coast,Maroochy Neighbourhood Centre,-26.6569507,153.0987594,10/1/2019,10/1/2019,4:30 PM,6:30 PM,2:00,120,Patient admission forms required ,0,3,2,0,0,0,5,0,0,0,0,0,0,0,,,Yes,Yes,Yes,Yes,5
Default,Sunshine Coast,Maroochy Neighbourhood Centre,-26.6569507,153.0987594,10/3/2019,10/3/2019,4:30 PM,6:30 PM,2:00,120,Maybe need some cleanup wipes for end of shift ??? ,2,5,1,0,0,4,33,0,0,0,0,0,0,0,,,Yes,Yes,Yes,Yes,5
Default,Sunshine Coast,Maroochy Neighbourhood Centre,-26.6569507,153.0987594,10/10/2019,10/10/2019,4:28 PM,6:33 PM,2:05,125,,3,3,3,0,0,2,14,0,0,0,0,0,0,0,,,Yes,Yes,No,Yes,5
Default,Sunshine Coast,Maroochy Neighbourhood Centre,-26.6569507,153.0987594,10/15/2019,10/15/2019,4:30 PM,6:30 PM,2:00,120,,0,2,9,0,0,0,10,0,0,0,0,0,0,0,,,Yes,Yes,Yes,Yes,5
Default,Sunshine Coast,Maroochy Neighbourhood Centre,-26.6569507,153.0987594,10/17/2019,10/17/2019,4:30 PM,6:32 PM,2:02,122,Glucometer not available ,0,1,1,0,0,0,11,0,0,0,0,0,0,0,,,Yes,Yes,Yes,Yes,5
Default,Sunshine Coast,Maroochy Neighbourhood Centre,-26.6569507,153.0987594,10/22/2019,10/22/2019,4:30 PM,6:30 PM,2:00,120,,0,3,6,0,0,2,9,0,0,0,0,0,0,0,,,Yes,Yes,Yes,Yes,5
Default,Sunshine Coast,Maroochy Neighbourhood Centre,-26.6569507,153.0987594,10/24/2019,10/24/2019,4:30 PM,6:58 PM,2:28,148,Great clinic! New Dr loved it! Printer issue ,3,3,5,0,0,8,31,0,0,0,0,0,0,0,,,Yes,Yes,Yes,Yes,5
Default,Sunshine Coast,Maroochy Neighbourhood Centre,-26.6569507,153.0987594,10/29/2019,10/29/2019,4:30 PM,6:30 PM,2:00,120,"Can we please have gauze, dressing packs and interpose when possible.
Sharon requests QML forms please. ",0,2,3,0,0,3,5,0,0,0,0,0,0,0,,,Yes,Yes,Yes,Yes,5
Default,Sunshine Coast,Maroochy Neighbourhood Centre,-26.6569507,153.0987594,10/31/2019,10/31/2019,4:30 PM,6:30 PM,2:00,120,Halloween night seemed quieter than usual,0,1,1,0,0,0,8,1,0,0,0,0,0,0,,,Yes,Yes,Yes,Yes,5
Default,Sunshine Coast,Maroochy Neighbourhood Centre,-26.6569507,153.0987594,11/5/2019,11/7/2019,4:30 PM,6:30 PM,2:00,120,Lou to follow up Di re patient concerns ,0,0,5,0,0,2,5,0,0,1,1,2,0,0,,,Yes,Yes,Yes,Yes,5
Default,Sunshine Coast,Maroochy Neighbourhood Centre,-26.6569507,153.0987594,11/7/2019,11/8/2019,4:30 PM,6:30 PM,2:00,120,Ask Di to follow up patient tomorrow ,0,4,5,0,0,3,5,0,2,1,1,2,0,0,,,Yes,Yes,Yes,Yes,5
Default,Sunshine Coast,Maroochy Neighbourhood Centre,-26.6569507,153.0987594,11/11/2019,1/22/2020,10:00 AM,1:00 PM,3:00,180,,15,10,0,0,0,0,18,0,0,0,0,0,0,0,,,Yes,Yes,Yes,Yes,5
Default,Sunshine Coast,Maroochy Neighbourhood Centre,-26.6569507,153.0987594,11/12/2019,11/12/2019,4:30 PM,6:30 PM,2:00,120,,0,2,2,0,0,2,9,1,0,1,0,2,0,0,,,Yes,Yes,No,Yes,5
Default,Sunshine Coast,Maroochy Neighbourhood Centre,-26.6569507,153.0987594,11/14/2019,11/14/2019,4:30 PM,6:30 PM,2:00,120,,0,1,2,0,0,3,8,0,3,1,0,1,0,0,,,Yes,Yes,Yes,Yes,5
Default,Sunshine Coast,Maroochy Neighbourhood Centre,-26.6569507,153.0987594,11/19/2019,11/19/2019,4:30 PM,6:30 PM,2:00,120,Quiet clinic tonight ,0,1,1,0,0,2,7,1,1,0,1,1,0,0,,,Yes,Yes,No,Yes,5
Default,Sunshine Coast,Maroochy Neighbourhood Centre,-26.6569507,153.0987594,11/21/2019,11/21/2019,4:30 PM,6:30 PM,2:00,120,,0,3,3,0,0,1,3,1,0,0,3,1,0,0,,,Yes,Yes,Yes,Yes,0
Default,Sunshine Coast,Maroochy Neighbourhood Centre,-26.6569507,153.0987594,11/26/2019,11/26/2019,4:30 PM,6:30 PM,2:00,120,,0,0,3,0,0,3,6,2,1,1,1,0,0,0,,,Yes,Yes,No,No,5
Default,Sunshine Coast,Maroochy Neighbourhood Centre,-26.6569507,153.0987594,11/28/2019,11/28/2019,4:30 PM,6:33 PM,2:03,123,Need gauze squares and dressing trays ,0,1,6,0,0,4,8,1,3,0,0,3,0,0,,,Yes,Yes,Yes,Yes,5
Default,Sunshine Coast,Maroochy Neighbourhood Centre,-26.6569507,153.0987594,12/3/2019,12/3/2019,4:30 PM,6:30 PM,2:00,120,Low stock of sterile gauze,0,0,1,0,0,1,4,0,0,0,1,2,0,0,,,Yes,Yes,Yes,Yes,5
Default,Sunshine Coast,Maroochy Neighbourhood Centre,-26.6569507,153.0987594,12/5/2019,12/9/2019,4:29 AM,6:35 AM,2:06,126,,0,0,2,0,0,0,4,0,0,0,2,0,0,0,,,Yes,Yes,No,No,5
Default,Sunshine Coast,Maroochy Neighbourhood Centre,-26.6569507,153.0987594,12/10/2019,12/11/2019,4:30 PM,6:30 PM,2:00,120,,0,0,4,0,0,3,27,0,1,0,2,0,0,0,,,Yes,Yes,No,Yes,5
Default,Sunshine Coast,Maroochy Neighbourhood Centre,-26.6569507,153.0987594,12/12/2019,12/12/2019,4:00 PM,6:28 PM,2:28,148,"Talking with people outside helps some people feel more comfortable talking about their health with nurses. 8 people had conversations with Tess outside, and 2 of them were referred to their session_reportss. Interesting enough, the one person in particular, session_reportst want me to open a file for her. The other referral was a couple who classify themselves as drifters, and also session_reportst want a file opened for the female. They will be at clinic next Tuesday - I will attend clinic next Tuesday, to follow up with the 2 people who were referred to their session_reportss.",0,0,2,0,0,2,12,0,3,0,0,0,0,0,,,Yes,Yes,No,No,5
Default,Sunshine Coast,Maroochy Neighbourhood Centre,-26.6569507,153.0987594,12/17/2019,12/17/2019,4:36 PM,6:40 PM,2:04,124,Merry Christmas ,0,0,6,0,0,4,15,3,4,0,0,0,0,0,,,Yes,Yes,No,No,5
Default,Sunshine Coast,Maroochy Neighbourhood Centre,-26.6569507,153.0987594,1/21/2020,1/21/2020,4:30 PM,6:10 PM,1:40,100,,0,0,1,0,0,2,2,1,1,0,0,0,0,0,,,Yes,Yes,Yes,Yes,5
Default,Sunshine Coast,Maroochy Neighbourhood Centre,-26.6569507,153.0987594,1/23/2020,1/23/2020,4:30 PM,7:03 PM,2:33,153,Notes not done - software issue will complete 24/01,0,0,0,2,0,2,10,0,1,0,0,0,0,0,,,Yes,No,No,No,5
Default,Sunshine Coast,Maroochy Neighbourhood Centre,-26.6569507,153.0987594,1/28/2020,1/28/2020,4:30 PM,6:31 PM,2:01,121,,0,0,2,1,0,2,5,1,2,0,0,0,0,0,,,Yes,Yes,No,Yes,5
Default,Sunshine Coast,Maroochy Neighbourhood Centre,-26.6569507,153.0987594,1/30/2020,1/30/2020,4:15 PM,6:48 PM,2:33,153,"Very busy clinic as I was the only nurse on and had a Buddy shift . Notes not completed, but will do so on Monday. session_reportst call for help, too busy. In saying all of this, all went well. My buddy   Left before we could debrief because a patient with mental health issues needed to speak with me. Tash did say that she will be back, but I will contact her when I get home ",3,0,0,1,0,2,10,0,4,2,0,0,0,0,,,No,No,No,No,5
Default,Sunshine Coast,Maroochy Neighbourhood Centre,-26.6569507,153.0987594,2/4/2020,2/4/2020,4:30 PM,6:44 PM,2:14,134,No time to do notes will do tomorrow ,0,0,7,11,0,5,11,0,2,1,0,0,0,0,,,Yes,No,No,No,5
Default,Sunshine Coast,Maroochy Neighbourhood Centre,-26.6569507,153.0987594,2/6/2020,2/6/2020,4:31 PM,6:49 PM,2:18,138,"Busy clinic tonight. 2nd buddy shift for two new vollies.
Consider having Mental Health after hours contact details for easy access.
Need to replace glucometer ",0,0,7,2,0,2,15,2,2,1,1,2,0,0,,,Yes,Yes,No,No,5
Default,Sunshine Coast,Maroochy Neighbourhood Centre,-26.6569507,153.0987594,2/11/2020,2/11/2020,4:00 PM,6:30 PM,2:30,150,,0,0,7,10,1,4,16,0,3,1,0,1,0,0,,,Yes,Yes,No,No,5
Default,Sunshine Coast,Maroochy Neighbourhood Centre,-26.6569507,153.0987594,2/13/2020,2/13/2020,4:30 AM,7:00 PM,14:30,870,Could we seek out printer options and prescription forms (GP) ,2,0,6,6,0,5,9,0,6,0,1,2,0,0,,,Yes,Yes,Yes,Yes,5
Default,Sunshine Coast,Maroochy Neighbourhood Centre,-26.6569507,153.0987594,2/18/2020,2/18/2020,4:20 PM,6:44 PM,2:24,144,,0,0,4,1,0,3,8,0,0,0,0,1,0,0,,,Yes,Yes,Yes,Yes,5
Default,Sunshine Coast,Maroochy Neighbourhood Centre,-26.6569507,153.0987594,2/20/2020,2/20/2020,4:00 PM,6:50 PM,2:50,170,,0,0,8,10,2,8,16,0,8,2,1,2,0,0,,,Yes,Yes,No,No,5
Default,Sunshine Coast,Maroochy Neighbourhood Centre,-26.6569507,153.0987594,2/25/2020,2/25/2020,4:29 PM,6:31 PM,2:02,122,,0,0,2,1,0,0,9,0,1,0,0,1,0,0,,,Yes,Yes,Yes,Yes,5
Default,Sunshine Coast,Maroochy Neighbourhood Centre,-26.6569507,153.0987594,2/27/2020,2/27/2020,4:00 PM,6:50 PM,2:50,170,,0,0,6,6,2,6,19,0,5,0,0,1,0,0,,,Yes,Yes,No,No,5
Default,Sunshine Coast,Maroochy Neighbourhood Centre,-26.6569507,153.0987594,3/3/2020,3/3/2020,4:30 PM,6:30 PM,2:00,120,,0,0,4,4,4,4,14,0,0,0,0,0,0,0,,,Yes,Yes,Yes,Yes,5
Default,Sunshine Coast,Maroochy Neighbourhood Centre,-26.6569507,153.0987594,3/5/2020,3/5/2020,4:00 PM,7:15 PM,3:15,195,"Hectic clinic!! Not happy about turning patients away, but we were just too busy, and Bec and I left well after 7pm!! I am concerned that we have been leaving clinic late - not fair on all the volunteers, and Tuela.",5,0,4,10,3,4,19,0,2,0,2,3,3,0,,,Yes,Yes,Yes,No,4
Default,Sunshine Coast,Maroochy Neighbourhood Centre,-26.6569507,153.0987594,3/10/2020,3/18/2020,4:00 PM,7:15 PM,3:15,195,MNC busy - Buddy shift with Peter. We need a doctor at MNC,0,0,7,4,0,4,13,2,4,0,0,3,0,0,,,Yes,Yes,No,No,4
Default,Sunshine Coast,Maroochy Neighbourhood Centre,-26.6569507,153.0987594,3/12/2020,3/18/2020,4:00 PM,6:45 PM,2:45,165,Great to meet and work with Rob - he was excellent with a mental health patient and reinforced what I have been saying to this patient for the past 2 months. Clinic busy.,0,3,4,4,0,3,11,2,2,0,0,3,0,0,,,Yes,Yes,No,No,4
Default,Sunshine Coast,Maroochy Neighbourhood Centre,-26.6569507,153.0987594,3/17/2020,3/18/2020,4:00 PM,7:30 PM,3:30,210,"Doctor needed at MNC - many new faces! MNC becoming very busy. It took an hour for an ambulance to turn up, to transport a patient to hospital!! Not fair on Service Provider or volunteers.",0,0,8,25,1,5,25,2,6,0,0,5,3,0,,,No,No,No,Yes,4
Default,Sunshine Coast,Maroochy Neighbourhood Centre,-26.6569507,153.0987594,3/19/2020,3/20/2020,4:00 PM,6:40 PM,2:40,160,"Aggression from a patient with BPD, because she was after a script. Another patient who feels hopeless, is threatening suicide. Difficult shift.",2,0,5,6,1,3,12,2,4,1,0,1,2,0,,,Yes,Yes,No,No,3
Default,Sunshine Coast,Maroochy Neighbourhood Centre,-26.6569507,153.0987594,3/24/2020,3/25/2020,4:00 PM,6:00 PM,2:00,120,We think that mental health issues for our patients are going to increase. Well done to MNC for still feeding the vulnerable.,1,0,2,14,0,2,14,2,14,0,0,1,0,0,,,Yes,Yes,No,No,5
Default,Sunshine Coast,Maroochy Neighbourhood Centre,-26.6569507,153.0987594,3/26/2020,3/27/2020,4:00 PM,6:40 PM,2:40,160,Clinic busier that Tuesday - people struggling with their mental health due to social distancing.,0,0,5,12,0,3,12,4,4,1,1,3,0,0,,,Yes,Yes,No,Yes,5
Default,Sunshine Coast,Maroochy Neighbourhood Centre,-26.6569507,153.0987594,3/31/2020,4/1/2020,4:00 PM,6:30 PM,2:30,150,First night trialing telehealth consults - Fantastic!! ,5,0,5,5,0,2,6,2,2,0,0,3,0,0,,,Yes,Yes,No,Yes,5
Default,Sunshine Coast,Maroochy Neighbourhood Centre,-26.6569507,153.0987594,4/2/2020,4/3/2020,4:00 PM,6:30 PM,2:30,150,Replace thermometer covers taken for The Shack,4,0,3,4,0,1,7,2,7,0,1,5,0,0,,,Yes,Yes,No,Yes,5
Default,Sunshine Coast,Maroochy Neighbourhood Centre,-26.6569507,153.0987594,4/7/2020,4/7/2020,4:00 PM,6:45 PM,2:45,165,Need thermometer covers and non stick dressings. Quiet evening. ,2,0,3,4,0,2,6,2,6,0,0,2,0,0,,,Yes,Yes,No,Yes,5
Default,Sunshine Coast,Maroochy Neighbourhood Centre,-26.6569507,153.0987594,4/9/2020,4/9/2020,4:00 PM,6:30 PM,2:30,150,5 homeless people housed today!!,0,0,4,3,0,0,6,3,3,0,0,0,0,0,,,Yes,Yes,No,Yes,5
Default,Sunshine Coast,Maroochy Neighbourhood Centre,-26.6569507,153.0987594,4/14/2020,4/14/2020,4:00 PM,6:30 PM,2:30,150,Great clinic.,1,0,4,8,0,5,14,2,6,0,1,1,0,0,,,Yes,Yes,No,Yes,5
Default,Sunshine Coast,Maroochy Neighbourhood Centre,-26.6569507,153.0987594,4/16/2020,4/17/2020,4:00 PM,7:30 PM,3:30,210,"Busy clinic - thank goodness for the extra hands! Dr. Bella brilliant!
Need specimen containers.",6,0,7,8,0,5,12,3,8,0,1,5,0,0,,,Yes,Yes,No,Yes,5
Default,Sunshine Coast,Maroochy Neighbourhood Centre,-26.6569507,153.0987594,4/21/2020,4/22/2020,4:00 PM,7:15 PM,3:15,195,"Busy night, need specimen jars. Angst among patients housed at The Hub.",2,0,8,10,0,4,16,4,10,0,0,5,0,0,,,Yes,Yes,No,Yes,5
Default,Sunshine Coast,Maroochy Neighbourhood Centre,-26.6569507,153.0987594,4/23/2020,4/24/2020,4:00 PM,6:30 PM,2:30,150,,1,0,6,6,0,2,12,3,6,0,0,2,0,0,,,Yes,Yes,No,Yes,5
