Default,Sunshine Coast,Suncoast Stadium ,-26.7337356,153.1231053,6/4/2020,6/4/2020,10:00 AM,12:30 PM,2:30,150,Unable to record patient details as no computer. Patient referred to QIHN after a discussion with Sonia,0,1,2,4,0,1,6,5,2,2,2,4,0,0,N/A,Nil,Yes,Yes,Yes,Yes,5
Default,Sunshine Coast,Suncoast Stadium ,-26.7337356,153.1231053,6/11/2020,6/11/2020,10:00 AM,12:30 PM,2:30,150,,0,0,0,6,0,1,8,4,2,0,3,4,0,0,0,"Sad that its our last day, some were not aware we were volunteers ",Yes,Yes,Yes,Yes,5
Default,Sunshine Coast,Tait Duke Cottage,-26.3974694,153.0437439,8/20/2019,8/20/2019,9:30 AM,12:19 PM,2:49,169,Thermometer battery dead,4,0,4,0,0,5,14,0,0,0,0,0,0,0,,,Yes,Yes,Yes,No,5
Default,Sunshine Coast,Tait Duke Cottage,-26.3974694,153.0437439,9/3/2019,9/3/2019,9:30 AM,11:45 AM,2:15,135,,0,0,0,0,0,0,20,0,0,0,0,0,0,0,,,Yes,Yes,No,Yes,5
Default,Sunshine Coast,Tait Duke Cottage,-26.3974694,153.0437439,9/17/2019,9/17/2019,9:00 AM,11:30 AM,2:30,150,"Serenaded with Shakespearen language! Welcome to 2 new RNs!!
Quiet clinic. Beautiful day!! Kait looks great in her pink shirt!! ",0,0,2,0,0,1,18,0,0,0,0,0,0,0,,,Yes,Yes,No,Yes,5
Default,Sunshine Coast,Tait Duke Cottage,-26.3974694,153.0437439,10/1/2019,10/1/2019,9:00 AM,11:35 AM,2:35,155,Need sharps container for Tewantin. Next fortnight is 100yr anniversary of cottage and 1yr of hub. Lovely clinic. Easy and complex. Day 1 of taking over Grill'd across Queensland!!! ,0,0,4,0,0,8,20,0,0,0,0,0,0,0,,,Yes,Yes,No,Yes,5
Default,Sunshine Coast,Tait Duke Cottage,-26.3974694,153.0437439,10/15/2019,10/15/2019,9:00 AM,12:34 PM,3:34,214,,0,0,10,0,0,7,100,0,0,0,0,0,0,0,,,Yes,Yes,No,Yes,5
Default,Sunshine Coast,Tait Duke Cottage,-26.3974694,153.0437439,10/29/2019,10/29/2019,9:30 AM,12:00 PM,2:30,150,"Unsterile gauze squares
",0,0,3,0,0,2,7,0,0,0,0,0,0,0,,,Yes,Yes,No,No,5
Default,Sunshine Coast,Tait Duke Cottage,-26.3974694,153.0437439,11/12/2019,11/12/2019,9:30 AM,11:15 AM,1:45,105,very quiet - good conversation with the service providers :),0,0,0,0,0,0,1,3,0,1,0,0,0,0,,,Yes,No,No,Yes,5
Default,Sunshine Coast,Tait Duke Cottage,-26.3974694,153.0437439,11/26/2019,11/26/2019,9:29 AM,11:29 AM,2:00,120,"Need glucometer, scissors, Panadol & Neurophen ",0,0,0,0,0,1,2,1,1,0,0,0,1,0,,,Yes,Yes,No,No,5
Default,Sunshine Coast,Tait Duke Cottage,-26.3974694,153.0437439,12/10/2019,12/10/2019,9:30 AM,11:27 AM,1:57,117,,0,0,2,0,0,1,10,0,0,0,0,0,0,0,,,Yes,Yes,No,No,5
Default,Sunshine Coast,Tait Duke Cottage,-26.3974694,153.0437439,1/21/2020,1/21/2020,9:15 AM,11:28 AM,2:13,133,"Quiet clinic, HHOT, Salvation Army supported accommodation & Housing rep here today. Great opportunity for team to meet service providers. ",0,0,0,0,0,0,2,3,0,0,0,0,0,0,,,No,No,No,No,5
Default,Sunshine Coast,Tait Duke Cottage,-26.3974694,153.0437439,2/4/2020,2/5/2020,9:30 AM,11:40 AM,2:10,130,Contacted SCUH on behalf of Richard 02.06.1978 re waiting time on Cat II appt. They called back 05.02.20. He is to call Outpt 52022222. They are aware Richard is homeless,4,0,0,3,0,0,3,2,1,0,0,0,0,0,,,Yes,Yes,No,Yes,5
Default,Sunshine Coast,Tait Duke Cottage,-26.3974694,153.0437439,2/18/2020,2/18/2020,9:28 AM,11:35 AM,2:07,127,"Rotary came and are organising a safe for the laptop. They will attach it to the floor.
I was wondering about any dressings for wounds? I only had gauze. ",0,0,1,2,0,1,3,4,0,0,0,0,0,0,,,Yes,Yes,Yes,Yes,5
Default,Sunshine Coast,Tait Duke Cottage,-26.3974694,153.0437439,3/3/2020,3/3/2020,9:21 PM,11:39 PM,2:18,138,On my own again. Got key for safe and put computer in there. Have to get pincode. Kylie from council is following this up. Need to put pad and pens into bag next fortnight. Darcy from Mental Health (&United Synergies) helped with one patient. I had to leave so not sure how this ended up.,0,0,2,2,0,1,6,2,2,0,0,0,0,0,,,No,Yes,Yes,No,5
Default,Sunshine Coast,Tait Duke Cottage,-26.3974694,153.0437439,3/17/2020,3/18/2020,9:30 AM,11:30 AM,2:00,120,great Good. Quiet day presumably due to CVOID-19. gave patients education about the virus and had lots of conversations. :),2,0,0,3,0,0,7,3,0,0,0,0,0,0,,,Yes,Yes,Yes,Yes,5
Default,Sunshine Coast,Tait Duke Cottage,-26.3974694,153.0437439,3/31/2020,4/2/2020,9:15 AM,11:29 AM,2:14,134,Quiet session. No other providers  present. Council staff went for walk about. But no one around. ,1,0,0,2,0,1,2,2,0,0,0,0,0,0,,,Yes,Yes,Yes,Yes,5
Default,Sunshine Coast,Tait Duke Cottage,-26.3974694,153.0437439,4/14/2020,6/1/2020,9:30 AM,11:30 AM,2:00,120,Quiet clinic,1,0,0,1,0,0,1,1,1,0,0,1,0,0,1,0,Yes,Yes,Yes,Yes,5
Default,Sunshine Coast,Tait Duke Cottage,-26.3974694,153.0437439,4/28/2020,5/20/2020,9:30 AM,11:30 AM,2:00,120,,0,0,0,6,0,0,6,2,2,0,0,0,0,0,0,0,Yes,Yes,No,No,5
Default,Sunshine Coast,Tait Duke Cottage,-26.3974694,153.0437439,5/12/2020,5/12/2020,9:29 AM,11:04 AM,1:35,95,Pretty  quiet  today. Mostly  people  popping  in  for showers only. ,4,0,2,6,1,1,8,2,2,0,0,3,0,0,Nil,,Yes,Yes,Yes,Yes,5
Default,Sunshine Coast,Tait Duke Cottage,-26.3974694,153.0437439,5/26/2020,5/26/2020,9:30 AM,11:30 AM,2:00,120,Personal care kits we provided to hand out. No Fluvax  given,3,0,1,4,0,2,4,3,3,0,2,2,0,0,0,3,Yes,Yes,Yes,Yes,5
Default,Sunshine Coast,Tait Duke Cottage,-26.3974694,153.0437439,6/9/2020,6/9/2020,9:30 AM,11:01 AM,1:31,91,,0,0,0,0,0,0,1,2,0,0,0,0,0,0,0,0,Yes,Yes,Yes,Yes,5
Default,Sunshine Coast,Tait Duke Cottage,-26.3974694,153.0437439,7/7/2020,7/7/2020,9:30 AM,11:01 AM,1:31,91,"Now set up at Tait Duke.
Nil patients post COVID ",0,0,0,0,0,0,1,3,0,0,0,0,0,0,Nil,Noosa council grateful for Sunny Street's return,Yes,Yes,Yes,Yes,5
Default,Sunshine Coast,Tait Duke Cottage,-26.3974694,153.0437439,8/4/2020,12/16/2020,9:30 AM,10:30 AM,1:00,60,No patients. very quiet,0,0,0,0,0,0,0,0,0,0,0,0,0,0,0,0,Yes,Yes,Yes,Yes,5
Default,Sunshine Coast,Tait Duke Cottage,-26.3974694,153.0437439,9/1/2020,9/1/2020,9:30 AM,10:59 AM,1:29,89,"Still no patients 
2 buddy shifts - they were aces! ",0,0,0,0,0,0,0,9,0,0,0,0,0,0,Nil,0,Yes,Yes,Yes,Yes,5
Default,Sunshine Coast,Tait Duke Cottage,-26.3974694,153.0437439,9/15/2020,9/15/2020,9:30 AM,11:07 AM,1:37,97,Nil patients. Service providers motivated ,0,0,0,0,0,0,0,5,0,0,0,0,0,0,0,0,Yes,Yes,Yes,Yes,5
Default,Sunshine Coast,Tait Duke Cottage,-26.3974694,153.0437439,9/29/2020,9/29/2020,9:30 AM,11:00 AM,1:30,90,Fun to start seeing patients at the rebuilding of this clinic ,1,0,0,1,0,0,2,9,1,1,1,0,0,0,I felt better now. You'll see me again ,,Yes,Yes,Yes,Yes,5
Default,Sunshine Coast,Tait Duke Cottage,-26.3974694,153.0437439,10/13/2020,10/14/2020,9:30 AM,11:00 AM,1:30,90,,2,0,2,0,0,1,5,2,1,0,2,2,0,0,0,,Yes,Yes,Yes,Yes,5
Default,Sunshine Coast,Tait Duke Cottage,-26.3974694,153.0437439,10/27/2020,12/16/2020,9:30 AM,10:29 AM,0:59,59,No patients - may take some time to restart engagement,0,0,0,0,0,0,0,4,0,0,0,0,0,0,0,0,Yes,Yes,Yes,Yes,5
Default,Sunshine Coast,Tait Duke Cottage,-26.3974694,153.0437439,11/10/2020,12/16/2020,9:30 AM,11:00 AM,1:30,90,,2,0,2,4,0,2,1,3,4,0,1,2,0,0,0,0,Yes,Yes,Yes,Yes,5
Default,Sunshine Coast,Tait Duke Cottage,-26.3974694,153.0437439,11/24/2020,12/16/2020,9:30 AM,11:31 AM,2:01,121,,4,0,4,8,0,3,1,3,6,0,2,4,0,0,0,0,Yes,Yes,Yes,Yes,5
Default,Sunshine Coast,Tait Duke Cottage,-26.3974694,153.0437439,12/8/2020,12/16/2020,9:30 AM,11:00 AM,1:30,90,,4,0,4,4,0,5,2,3,7,0,4,4,0,0,0,0,Yes,Yes,Yes,Yes,5
Default,Sunshine Coast,Tait Duke Cottage,-26.3974694,153.0437439,2/16/2021,2/16/2021,9:00 AM,11:00 PM,14:00,840,,0,0,2,2,0,0,2,0,2,0,0,2,0,0,0,0,No,No,No,No,5
Default,Sunshine Coast,Tait Duke Cottage,-26.3974694,153.0437439,3/2/2021,3/2/2021,9:00 AM,11:30 AM,2:30,150,Fantastic to work with Irene(RN). Irene appreciated having an overview of BP,0,0,1,0,0,1,2,4,0,0,0,0,0,1,0,0,No,Yes,No,Yes,5
Default,Sunshine Coast,Tait Duke Cottage,-26.3974694,153.0437439,3/16/2021,3/16/2021,9:00 AM,11:30 AM,2:30,150,"From the perspective of patient care it was a great shift. I had time to get to know the 2 patients and really listen to their personal stories. Both needed advice and assistance with their health needs. I learnt a lot from both patients and other service providers who shared their perspectives on the issues homeless people face. 

Unfortunately I could not access Best Practice due to a combination of connectivity issues and my lack of knowledge. This was despite the efforts of Tess to try to help me over the phone and giving me a prior rundown - some students are like that Tess! I am organizing with Tess to come into the office and make sure I am on track for next clinic. At least I now know what I don't know.

Overall it was really satisfying and I loved being there.",0,0,2,1,0,1,3,3,1,0,1,2,0,0,I was able to spend over 30 minutes with both patients and get to know them better. They both really appreciated that Sunny Street  staff take the time to listen.,The Coordinator (not sure of her name sorry) thanked Sunny Street for being there for their clients.,Yes,No,No,Yes,5
Default,Sunshine Coast,Tait Duke Cottage,-26.3974694,153.0437439,3/30/2021,3/30/2021,9:00 AM,11:15 AM,2:15,135,"Very rewarding to meet a new patient  todaywho is desperately needing medical care and a service she can trust. To have the time to really listen to her problems, identify a way forward  and connect her to a doctor - all within 48 hrs - is very satisfying. Sunny Street is doing a great job.",0,0,3,1,0,1,3,1,1,1,0,1,0,0,"New patient today has been struggling to find a service to help her resolve long term health problems. She said ""at last I am getting some help - thank you"".",0,Yes,Yes,Yes,Yes,5
Default,Brisbane,Telehealth Clinic,-27.3812533,152.7130155,10/23/2019,10/23/2019,4:15 PM,6:10 PM,1:55,115,Potential for confidentiality issues with multiple staff stations under marquee. Great response from community. Orange Sky and Rosie's. Barber service also in attendance.,0,2,10,0,0,4,26,0,0,0,0,0,0,0,,,Yes,Yes,Yes,Yes,5
Default,Brisbane,Telehealth Clinic,-27.3812533,152.7130155,10/30/2019,10/30/2019,4:15 PM,6:00 PM,1:45,105,"Baby scales would be awesome.
Volunteer will try to arrange some for next week. ",0,2,11,0,0,4,14,2,3,0,0,5,0,0,,,Yes,Yes,Yes,Yes,5
Default,Brisbane,Telehealth Clinic,-27.3812533,152.7130155,11/6/2019,11/6/2019,4:15 PM,6:20 PM,2:05,125,"Script paper required.
Potentially able to get some space from Busy at Work (Ness' employer)",0,0,9,0,0,0,24,0,0,0,4,8,0,0,,,Yes,Yes,No,No,5
Default,Brisbane,Telehealth Clinic,-27.3812533,152.7130155,11/13/2019,11/13/2019,4:15 PM,7:00 PM,2:45,165,"session_reportsm not sure of session_reportss surname so I have not entered her name as there are two of them listed. Brief orientation provided. It is awesome to have her on team.ErinI

We called QAS to transport a 15yo boy to IGH. Dehydration possibly viral or food poisoning. Whole family recently sick. Whole family homeless. Asked for Social Work consult are hospital and referred to Micah and others via Homeless Connect.

We need more T-shirts please. Erin would like a large in pink please. We also need forms for documentation. None available tonight due to Danielle not being there. Could not log in to laptop. Said no domain. I will type out our notes and email them.

Excellent night. Thank you. ",0,0,9,0,0,2,13,0,3,0,0,1,0,0,,,Yes,Yes,Yes,Yes,5
Default,Brisbane,Telehealth Clinic,-27.3812533,152.7130155,11/20/2019,11/20/2019,4:15 PM,7:00 PM,2:45,165,It was reported by a gentleman that comes regularly that a Sunny Street Nurse stopped at a service station in her way home. A gentleman session_reportst have enough for a bottle of milk so she bought it for him. We think it may have been Erin last week. Not all good deeds go unseen. ,0,0,5,0,0,3,19,0,3,1,1,0,0,0,,,Yes,Yes,Yes,Yes,5
Default,Brisbane,Telehealth Clinic,-27.3812533,152.7130155,11/27/2019,11/27/2019,4:15 PM,7:30 PM,3:15,195,Please see my email. Some volunteers keen to work Christmas Day and New Years Day if service available. ,0,0,10,0,0,4,13,0,3,1,1,2,0,0,,,Yes,Yes,Yes,Yes,5
Default,Brisbane,Telehealth Clinic,-27.3812533,152.7130155,12/4/2019,12/11/2019,4:15 PM,7:00 PM,2:45,165,,0,0,5,0,0,2,26,0,4,2,0,0,0,0,,,Yes,Yes,No,No,5
Default,Brisbane,Telehealth Clinic,-27.3812533,152.7130155,12/11/2019,12/11/2019,4:15 PM,7:00 PM,2:45,165,"It is getting critical that we find storage space and someone to set up each week. Please see message on Whats App. We desperately need waterproof dressings, letterhead for referrals, printer, script paper, gauze, thermometer covers, XL BP cuff, large T-shirts. Orange Sky are going Christmas Day and New Years Day and have asked again if we will attend with them. ",0,0,8,0,0,4,16,3,2,1,0,0,0,0,,,Yes,Yes,No,Yes,5
Default,Brisbane,Telehealth Clinic,-27.3812533,152.7130155,12/18/2019,12/18/2019,4:15 PM,7:00 PM,2:45,165,Very busy night but people very engaged and happy to wait to speak with us. Marquee kept blowing away. Need tent pegs and sandbags. Need to be sure if recommencement date and have equipment and supplies returned by then. Need local storage as a priority. ,0,0,0,0,0,5,28,5,5,1,0,0,0,0,,,Yes,Yes,No,Yes,5
Default,Brisbane,Telehealth Clinic,-27.3812533,152.7130155,1/15/2020,1/16/2020,4:15 PM,7:00 PM,2:45,165,"Two new volunteers to observe and assist prior to registration.
Maddy - Student Nurse/Medical Assistance lives in Port Macquarie. Will volunteer when local to attend prac for USQ.
Melita MacMahon - RN/Midwife/Lactation Consultant/Nurse Immuniser. Lives in Armidale but will volunteer when up I. -ld for work, ARL etc.Q
We again have no storage facilities. I will email IHF re same. This needs to be sorted ASAP.
We need a couple of stethoscopes and all kinds of dressings. Waterproof dressings a real help.
We need referral letterhead.
Instructions for laptops including passwords for each practitioner needed ASAP too please.
Thank you. ",0,0,16,0,0,3,41,3,3,2,0,2,0,0,,,Yes,Yes,No,Yes,5
Default,Brisbane,Telehealth Clinic,-27.3812533,152.7130155,1/22/2020,1/22/2020,4:15 PM,7:00 PM,2:45,165,It was great to have Dr Nova and Abbey visit tonight. Thank you for the support. We think heat and rain threat have kept people away this week. ,0,0,6,4,0,1,13,0,2,0,0,0,0,0,,,Yes,Yes,No,Yes,5
Default,Brisbane,Telehealth Clinic,-27.3812533,152.7130155,2/5/2020,2/5/2020,4:30 PM,6:16 PM,1:46,106,Was told by clinic patients that clinic had been shut down. Attempted to get in contact with other volunteers and with sunny st but due to after hours no answer. Unfortunately I was not notified so ran the clinic independently tonight with the assistance of the orange sky and rosies volunteers ,0,0,4,1,0,1,6,0,2,0,0,0,0,0,,,Yes,Yes,No,No,1
Default,Brisbane,Telehealth Clinic,-27.3812533,152.7130155,8/6/2019,8/6/2019,6:00 PM,8:30 PM,2:30,150,Shift went well! Busy night! Youngest patient 6 months old. ,0,0,6,0,0,0,10,0,0,0,0,0,0,0,,,Yes,Yes,Yes,Yes,5
Default,Brisbane,Telehealth Clinic,-27.3812533,152.7130155,8/8/2019,8/8/2019,6:30 PM,8:00 PM,1:30,90,Red Cross showed a video that includes Sunny Street - it's on the red Cross website. Good engagement today. ,0,0,6,0,0,3,8,0,0,0,0,0,0,0,,,Yes,Yes,Yes,Yes,5
Default,Brisbane,Telehealth Clinic,-27.3812533,152.7130155,8/13/2019,8/13/2019,6:30 PM,8:02 PM,1:32,92,,2,0,0,0,0,1,3,0,0,0,0,0,0,0,,,Yes,Yes,Yes,Yes,5
Default,Brisbane,Telehealth Clinic,-27.3812533,152.7130155,8/15/2019,8/15/2019,6:00 PM,8:14 PM,2:14,134,"Need restocking dressings
Garbage bags
Team feeling disheartened with long-term bagss situation ",3,1,3,0,0,2,7,0,0,0,0,0,0,0,,,Yes,Yes,Yes,No,5
Default,Brisbane,Telehealth Clinic,-27.3812533,152.7130155,8/20/2019,8/20/2019,6:20 PM,8:22 PM,2:02,122,Busy night! Not enough time for me to see all people unfortunately. Some people with increased time requirements for assistance and lengthy conversations. Enjoyable!,0,0,3,0,0,0,3,0,0,0,0,0,0,0,,,Yes,Yes,Yes,Yes,5
Default,Brisbane,Telehealth Clinic,-27.3812533,152.7130155,8/22/2019,8/22/2019,6:00 PM,8:01 PM,2:01,121,Bigger gloves. Quiet night! ,3,1,1,0,0,3,6,0,0,0,0,0,0,0,,,Yes,No,Yes,Yes,5
Default,Brisbane,Telehealth Clinic,-27.3812533,152.7130155,8/27/2019,8/27/2019,6:25 PM,8:19 PM,1:54,114,BGL kit missing. Consider antibacterial wipes in kits. Good conversations. ,0,0,3,0,0,0,3,0,0,0,0,0,0,0,,,Yes,Yes,Yes,Yes,5
Default,Brisbane,Telehealth Clinic,-27.3812533,152.7130155,8/29/2019,8/29/2019,6:00 PM,8:15 PM,2:15,135,Pharmacy trip to 3 to get the meds needed. Police took 6 kids away trying to get into cafe - massive deterrent. ,2,0,3,0,0,0,6,0,0,0,0,0,0,0,,,Yes,No,Yes,Yes,5
Default,Brisbane,Telehealth Clinic,-27.3812533,152.7130155,9/3/2019,9/3/2019,6:00 PM,8:27 PM,2:27,147,Vesp for volunteering support. Some young kids homeless and adults chroming really saddening. 4 vollies - absolutely needed!! Need thermometer covers. ,0,0,9,0,0,9,26,0,0,0,0,0,0,0,,,Yes,Yes,No,Yes,5
Default,Brisbane,Telehealth Clinic,-27.3812533,152.7130155,9/12/2019,9/12/2019,6:00 PM,8:06 PM,2:06,126,"Very quiet night! One person very grateful forhow the SS team. Are - kind, good, respectful and huggers! Another lady we saw a month ago came up behind us in the street, tapped a nurse on the shoulder and said hello - started talking about her life. Said she follows SS on Facebook. Hugged the nurse. The nurse thanked her for tapping us on the shoulder! 3 youth phoned the SS line before the clinic began. Talking about general life: work, medications, thoughts, appts they had been to, meals they ate, peers they should befriend or avoid. Great chats! ",0,0,3,0,0,0,8,0,0,0,0,0,0,0,,,Yes,Yes,No,Yes,5
Default,Brisbane,Telehealth Clinic,-27.3812533,152.7130155,9/17/2019,9/17/2019,6:30 PM,8:08 PM,1:38,98,,3,0,5,0,0,9,17,0,0,0,0,0,0,0,,,Yes,Yes,Yes,Yes,5
Default,Brisbane,Telehealth Clinic,-27.3812533,152.7130155,9/24/2019,9/24/2019,6:00 PM,8:05 PM,2:05,125,"One patient sang to a nurse. Beautiful! Goodebumps!
Walked a Pt to the police station for support post clinic re alleged assault. Quiet night but our time completely taken up with conversations. ",0,0,4,0,0,8,7,0,0,0,0,0,0,0,,,Yes,Yes,Yes,Yes,5
Default,Brisbane,Telehealth Clinic,-27.3812533,152.7130155,9/26/2019,9/26/2019,6:01 PM,8:15 PM,2:14,134,Bandages needed. Cold pack too. Lots of mental health distress. Linked in to services .paid for medications.,0,0,6,0,0,7,6,0,0,0,0,0,0,0,,,Yes,Yes,Yes,Yes,5
Default,Brisbane,Telehealth Clinic,-27.3812533,152.7130155,10/1/2019,10/1/2019,6:00 PM,8:13 PM,2:13,133,Need Bgl machines and urine jars. Bec brought in donations of dressings! ,0,0,6,0,0,7,10,0,0,0,0,0,0,0,,,Yes,Yes,No,Yes,5
Default,Brisbane,Telehealth Clinic,-27.3812533,152.7130155,10/3/2019,10/4/2019,6:00 PM,8:00 PM,2:00,120,,0,0,4,0,0,4,3,0,0,0,0,0,0,0,,,Yes,Yes,No,Yes,5
Default,Brisbane,Telehealth Clinic,-27.3812533,152.7130155,10/8/2019,10/8/2019,6:00 PM,8:18 PM,2:18,138,"Urine jars, ward tests, sharps container, rubbish bags, QAS transfer to rbh. Referral to Beddown ",0,0,5,0,0,6,8,0,0,0,0,0,0,0,,,Yes,Yes,No,Yes,5
Default,Brisbane,Telehealth Clinic,-27.3812533,152.7130155,10/10/2019,10/10/2019,6:30 PM,8:09 PM,1:39,99,Great shift! Goes quickly! Welcomed Raquel back!!!! ,3,0,6,0,0,8,6,0,0,0,0,0,0,0,,,Yes,Yes,Yes,Yes,5
Default,Brisbane,Telehealth Clinic,-27.3812533,152.7130155,10/15/2019,10/15/2019,6:29 PM,8:29 PM,2:00,120,"Had to purchase Meds from pharmacy.
Fairly quite night.",4,0,3,0,0,7,20,0,0,0,0,0,0,0,,,Yes,No,No,Yes,5
Default,Brisbane,Telehealth Clinic,-27.3812533,152.7130155,10/17/2019,10/17/2019,6:30 PM,8:23 PM,1:53,113,"Strapped fractured finger, urinalysis, two bgl, dressed cigarette burn with betadine.  Really busy night. ",0,0,5,0,0,4,6,0,0,0,0,0,0,0,,,Yes,Yes,No,Yes,5
Default,Brisbane,Telehealth Clinic,-27.3812533,152.7130155,10/22/2019,10/22/2019,6:15 PM,8:37 PM,2:22,142,Need more small and medium island dressing,4,0,0,0,0,1,6,0,0,0,0,0,0,0,,,Yes,No,Yes,Yes,5
Default,Brisbane,Telehealth Clinic,-27.3812533,152.7130155,10/24/2019,10/24/2019,6:25 PM,8:20 PM,1:55,115,Liz orientation shift went well. Ben Cuddled a baby!!,2,0,0,0,0,0,7,0,0,0,0,0,0,0,,,Yes,Yes,Yes,Yes,5
Default,Brisbane,Telehealth Clinic,-27.3812533,152.7130155,10/29/2019,10/29/2019,6:30 PM,8:27 PM,1:57,117,Pharmacy: Bec will contract Sonia regarding billing discussion with pharmacy,6,3,0,0,0,4,14,0,0,0,0,0,0,0,,,Yes,Yes,Yes,Yes,4
Default,Brisbane,Telehealth Clinic,-27.3812533,152.7130155,10/31/2019,10/31/2019,6:20 PM,8:26 PM,2:06,126,session_reportss first shift done! One ice pack used for ankle,0,0,1,0,3,2,13,0,0,0,0,3,0,0,,,Yes,Yes,Yes,Yes,5
Default,Brisbane,Telehealth Clinic,-27.3812533,152.7130155,11/5/2019,11/5/2019,6:30 PM,8:13 PM,1:43,103,Orientated 2 new RNs. Quiet night! ,0,0,3,0,0,5,22,4,3,0,1,1,0,0,,,No,Yes,No,Yes,5
Default,Brisbane,Telehealth Clinic,-27.3812533,152.7130155,11/7/2019,11/7/2019,6:30 PM,8:19 PM,1:49,109,Pretty quiet night. Jeanette first shift went well,1,0,2,0,0,1,5,0,1,0,2,0,0,0,,,Yes,Yes,Yes,Yes,5
Default,Brisbane,Telehealth Clinic,-27.3812533,152.7130155,11/12/2019,11/12/2019,6:30 PM,8:17 PM,1:47,107,,5,0,7,0,0,5,25,5,2,1,1,3,0,0,,,Yes,Yes,Yes,No,5
Default,Brisbane,Telehealth Clinic,-27.3812533,152.7130155,11/19/2019,11/19/2019,6:30 PM,8:17 PM,1:47,107,Awesome Sunny Street vollies :-),0,0,0,0,0,1,6,2,0,0,0,0,2,0,,,Yes,Yes,No,Yes,5
Default,Brisbane,Telehealth Clinic,-27.3812533,152.7130155,11/21/2019,11/21/2019,6:30 PM,8:30 PM,2:00,120,,0,0,5,0,0,1,8,0,0,0,1,3,0,0,,,Yes,Yes,Yes,Yes,5
Default,Brisbane,Telehealth Clinic,-27.3812533,152.7130155,11/26/2019,11/26/2019,6:30 PM,8:11 PM,1:41,101,Need some dressing packs if available please,0,0,5,0,0,4,12,3,1,0,4,3,0,0,,,Yes,Yes,Yes,Yes,5
Default,Brisbane,Telehealth Clinic,-27.3812533,152.7130155,11/28/2019,11/28/2019,6:30 PM,8:30 PM,2:00,120,Need easier communication when cancelling shift to advise other team members and staff ,4,0,0,0,0,0,4,2,2,0,0,0,0,0,,,Yes,No,Yes,Yes,5
Default,Brisbane,Telehealth Clinic,-27.3812533,152.7130155,12/3/2019,12/3/2019,6:30 PM,8:06 PM,1:36,96,Awesome nurse,0,0,4,0,0,1,16,2,0,0,2,1,0,0,,,Yes,Yes,Yes,Yes,5
Default,Brisbane,Telehealth Clinic,-27.3812533,152.7130155,12/5/2019,12/15/2019,6:30 PM,8:20 PM,1:50,110,"Varied clinic, new patients, 3 long term ss patients in clinic.Great connections - so far patients have plans for Christmas period re food.
Good, busy clinic! Team need shirts.",0,0,6,0,0,8,11,6,6,1,5,4,0,0,,,Yes,Yes,No,Yes,5
Default,Brisbane,Telehealth Clinic,-27.3812533,152.7130155,12/10/2019,12/10/2019,6:30 PM,8:30 PM,2:00,120,Busy shift.Lots of conversations. ,4,0,4,0,1,1,10,2,2,1,0,1,0,0,,,Yes,Yes,Yes,Yes,5
Default,Brisbane,Telehealth Clinic,-27.3812533,152.7130155,12/12/2019,12/12/2019,6:30 PM,8:01 PM,1:31,91,,0,0,4,0,0,2,6,4,2,0,1,2,0,0,,,Yes,Yes,Yes,Yes,5
Default,Brisbane,Telehealth Clinic,-27.3812533,152.7130155,12/17/2019,12/17/2019,6:30 PM,8:16 PM,1:46,106,"Awesome nurses
Merry Christmas ",0,0,4,0,0,3,14,7,3,2,2,3,0,0,,,Yes,Yes,Yes,Yes,5
Default,Brisbane,Telehealth Clinic,-27.3812533,152.7130155,12/19/2019,12/19/2019,6:40 PM,8:11 PM,1:31,91,Possibilty of ordering ketone strips for use in glucometre. ,0,0,4,0,0,2,8,2,2,1,0,0,0,0,,,Yes,Yes,Yes,No,5
Default,Brisbane,Telehealth Clinic,-27.3812533,152.7130155,1/16/2020,1/16/2020,6:00 PM,8:11 PM,2:11,131,"3 nursing consults, discussed local services available, and health promotion and education.
Pharmacy referral and dressings attended too. Nursibg assessment and interventions applied as clinically signed and appropriate. ",0,0,3,0,0,1,4,3,2,1,1,2,0,0,,,Yes,Yes,Yes,Yes,5
Default,Brisbane,Telehealth Clinic,-27.3812533,152.7130155,1/21/2020,1/21/2020,6:30 PM,8:15 PM,1:45,105,"Need Bedine, access to pharmacy ?",0,0,3,0,0,2,16,5,5,0,2,0,0,0,,,Yes,Yes,Yes,Yes,5
Default,Brisbane,Telehealth Clinic,-27.3812533,152.7130155,1/23/2020,1/23/2020,6:30 PM,8:15 PM,1:45,105,Quiet night. Awesome nursing support staff ,0,0,2,0,0,1,8,2,1,0,0,0,0,0,,,Yes,Yes,Yes,Yes,5
Default,Brisbane,Telehealth Clinic,-27.3812533,152.7130155,1/28/2020,1/28/2020,6:30 PM,8:07 PM,1:37,97,"Need to look into what dressings we have and what is needed
Awesome nurses",0,0,5,5,0,3,12,6,2,0,0,2,0,0,,,Yes,Yes,Yes,Yes,5
Default,Brisbane,Telehealth Clinic,-27.3812533,152.7130155,1/30/2020,1/30/2020,6:20 PM,8:18 PM,1:58,118,Server down on laptop. Will email notes about Pt assessments. ,0,0,2,1,0,0,5,2,2,1,0,1,0,0,,,Yes,Yes,Yes,Yes,5
Default,Brisbane,Telehealth Clinic,-27.3812533,152.7130155,2/4/2020,2/4/2020,6:30 PM,8:31 PM,2:01,121,"Awesome nurse, busy night",0,0,4,4,0,2,13,4,1,1,1,2,2,0,,,Yes,Yes,Yes,Yes,5
Default,Brisbane,Telehealth Clinic,-27.3812533,152.7130155,2/11/2020,2/12/2020,6:29 PM,8:35 PM,2:06,126,BGL kit not working,0,0,5,6,0,6,5,4,1,0,2,3,0,0,,,Yes,Yes,Yes,Yes,5
Default,Brisbane,Telehealth Clinic,-27.3812533,152.7130155,2/13/2020,2/13/2020,5:43 PM,8:03 PM,2:20,140,,0,0,0,9,0,0,0,0,1,1,0,0,0,0,,,Yes,Yes,Yes,Yes,5
Default,Brisbane,Telehealth Clinic,-27.3812533,152.7130155,2/18/2020,2/18/2020,6:30 PM,8:33 PM,2:03,123,"A bit more volatile in the community space tonight.
Awesome nurse",0,0,3,5,0,1,13,6,5,0,0,2,0,0,,,Yes,Yes,No,No,3
Default,Brisbane,Telehealth Clinic,-27.3812533,152.7130155,2/20/2020,2/20/2020,6:30 PM,8:01 PM,1:31,91,Quiet night.,0,0,0,0,0,0,4,0,1,0,0,0,0,0,,,Yes,No,No,Yes,4
Default,Brisbane,Telehealth Clinic,-27.3812533,152.7130155,2/25/2020,2/25/2020,6:30 PM,8:17 PM,1:47,107,Awesome nurse Simone,0,0,5,5,0,2,9,5,5,0,2,3,0,0,,,Yes,Yes,No,No,5
Default,Brisbane,Telehealth Clinic,-27.3812533,152.7130155,2/27/2020,2/27/2020,6:30 PM,8:02 PM,1:32,92,,0,2,0,0,0,0,0,0,0,0,0,0,0,0,,,No,No,No,No,0
Default,Brisbane,Telehealth Clinic,-27.3812533,152.7130155,3/3/2020,3/3/2020,6:02 PM,8:07 PM,2:05,125,,0,0,3,5,0,4,9,3,1,0,0,0,0,0,,,Yes,Yes,Yes,Yes,5
Default,Brisbane,Telehealth Clinic,-27.3812533,152.7130155,3/12/2020,3/12/2020,6:30 PM,8:00 PM,1:30,90,,0,0,2,1,0,1,2,0,1,0,1,0,0,0,,,No,Yes,No,No,5
Default,Brisbane,Telehealth Clinic,-27.3812533,152.7130155,3/17/2020,3/17/2020,6:01 PM,8:00 PM,1:59,119,"Quiet shift, Red cross closed cafe only. Red Cross very low on volunteers. 
Need masks for clinic",0,0,2,8,0,0,9,2,2,0,0,1,0,0,,,Yes,Yes,Yes,Yes,4
