Default,Brisbane,Telehealth Clinic,-27.3812533,152.7130155,3/24/2020,3/24/2020,6:30 PM,8:05 PM,1:35,95,"With 2 nurses could have 2 clients inside but will need too comply with RC safety guidelines.
Awesome nurse Simone and new nurse Ajax.
Campfire on iphones not operating today.",0,0,6,3,0,1,17,7,1,0,0,2,0,0,,,Yes,Yes,No,No,5
Default,Brisbane,Telehealth Clinic,-27.3812533,152.7130155,3/26/2020,3/26/2020,6:30 PM,8:23 PM,1:53,113,Limited door service at Red Cross. Quiet night in the city.,0,1,0,0,0,0,2,2,2,0,0,0,0,0,,,Yes,Yes,No,Yes,5
Default,Sunshine Coast,The Daily Bread,-26.6277779,152.958561,9/25/2019,9/26/2019,4:30 AM,6:21 AM,1:51,111,"Inaugural clinic at Daily Bread! Much excitement expressed by Daily Bread & Orange Sky crew members.

2 new patients & one patient from the Shack ",0,0,3,0,0,2,24,0,0,0,0,0,0,0,,,Yes,No,No,No,5
Default,Sunshine Coast,The Daily Bread,-26.6277779,152.958561,10/2/2019,10/2/2019,4:30 PM,6:15 PM,1:45,105,,0,0,5,0,0,2,5,0,0,0,0,0,0,0,,,Yes,Yes,No,Yes,5
Default,Sunshine Coast,The Daily Bread,-26.6277779,152.958561,10/9/2019,10/9/2019,4:30 PM,6:00 PM,1:30,90,,0,0,1,0,0,0,12,0,0,0,0,0,0,0,,,Yes,Yes,No,Yes,5
Default,Sunshine Coast,The Daily Bread,-26.6277779,152.958561,10/16/2019,10/16/2019,4:30 PM,6:08 PM,1:38,98,"Fit Kits needed for nursing bag, betadine swabs ",0,0,4,0,0,0,7,0,0,0,0,0,0,0,,,Yes,Yes,No,No,5
Default,Sunshine Coast,The Daily Bread,-26.6277779,152.958561,10/23/2019,10/23/2019,4:28 PM,6:00 PM,1:32,92,,0,0,1,0,0,1,5,0,0,0,0,0,0,0,,,Yes,Yes,No,No,5
Default,Sunshine Coast,The Daily Bread,-26.6277779,152.958561,10/30/2019,10/30/2019,4:30 PM,6:00 PM,1:30,90,Quiet night,0,1,0,0,0,0,4,0,0,0,0,0,0,0,,,Yes,Yes,No,Yes,5
Default,Sunshine Coast,The Daily Bread,-26.6277779,152.958561,11/6/2019,11/7/2019,4:30 PM,6:30 PM,2:00,120,,0,0,0,0,0,0,3,0,0,3,0,0,0,0,,,No,Yes,Yes,Yes,5
Default,Sunshine Coast,The Daily Bread,-26.6277779,152.958561,11/13/2019,11/13/2019,4:45 PM,6:07 PM,1:22,82,Slowly clients are approaching me or asking orange sky staff what I can do for them - it may take time to build their confidence ,0,2,0,0,0,0,3,2,0,0,0,1,0,0,,,No,Yes,No,Yes,0
Default,Sunshine Coast,The Daily Bread,-26.6277779,152.958561,11/20/2019,11/20/2019,4:29 PM,6:20 PM,1:51,111,,0,0,2,0,0,1,3,2,0,0,2,1,0,0,,,No,Yes,No,No,5
Default,Sunshine Coast,The Daily Bread,-26.6277779,152.958561,11/27/2019,11/27/2019,4:27 PM,6:15 PM,1:48,108,,0,2,2,0,0,1,5,3,0,0,1,0,0,0,,,Yes,Yes,No,No,5
Default,Sunshine Coast,The Daily Bread,-26.6277779,152.958561,12/11/2019,12/11/2019,4:28 PM,6:00 PM,1:32,92,,0,0,2,0,0,1,7,3,1,0,0,0,0,0,,,No,Yes,No,No,5
Default,Sunshine Coast,The Daily Bread,-26.6277779,152.958561,1/15/2020,1/17/2020,4:25 PM,6:22 PM,1:57,117,"New Nurse Vollie Jill attended TDB clinic tonight.
Nursing kit & laptop stored in locked cupboard _key stored in draw just above cupboard, spare key kept with office staff. ",0,0,2,0,0,2,4,3,2,0,0,1,0,0,,,Yes,Yes,No,No,5
Default,Sunshine Coast,The Daily Bread,-26.6277779,152.958561,1/22/2020,1/22/2020,4:25 PM,6:30 PM,2:05,125,"Very busy clinic, 2 new patients. The hall was full.
Nursing kit needs batteries for thermometer, dressings, cavil on, glucometer. Rubbish bags. Maybe some scales? ",0,0,5,4,0,1,5,2,4,0,2,0,0,0,,,Yes,Yes,No,No,5
Default,Sunshine Coast,The Daily Bread,-26.6277779,152.958561,1/29/2020,1/29/2020,4:30 PM,6:30 PM,2:00,120,"Kit needs scissors

Very busy clinic",0,0,2,1,0,2,7,4,3,0,1,1,0,0,,,No,Yes,No,No,5
Default,Sunshine Coast,The Daily Bread,-26.6277779,152.958561,2/5/2020,2/5/2020,4:30 PM,6:05 PM,1:35,95,,0,0,3,0,0,2,7,3,0,0,0,2,0,0,,,No,Yes,No,No,5
Default,Sunshine Coast,The Daily Bread,-26.6277779,152.958561,2/12/2020,2/12/2020,4:30 PM,6:31 PM,2:01,121,"Very busy clinic, pamper night for ladies, great to see so many attend. Hall looked fabulous
Need normal saline for kit.
Need to on board more vollies for Daily Bread",0,0,7,2,0,3,5,4,2,0,1,3,0,0,,,Yes,Yes,No,No,5
Default,Sunshine Coast,The Daily Bread,-26.6277779,152.958561,2/19/2020,2/19/2020,4:31 PM,6:29 PM,1:58,118,"Dressing packs & gloves needed for nursing kit
New patient, 50 year old lady living in her car since November, flee domestic violence situation.",0,0,5,3,0,1,6,2,3,0,1,1,0,0,,,Yes,Yes,No,No,5
Default,Sunshine Coast,The Daily Bread,-26.6277779,152.958561,2/26/2020,2/26/2020,4:30 PM,6:00 PM,1:30,90,New vollie Fiona tonight. Need saline for Nursing kit,0,0,4,2,0,1,5,2,1,0,1,0,0,0,,,Yes,Yes,No,No,5
Default,Sunshine Coast,The Daily Bread,-26.6277779,152.958561,3/4/2020,3/4/2020,4:29 PM,6:22 PM,1:53,113,Normal Saline needed,0,0,2,7,0,1,8,3,4,0,0,3,0,0,,,Yes,Yes,No,No,5
Default,Sunshine Coast,The Daily Bread,-26.6277779,152.958561,3/18/2020,3/23/2020,4:18 PM,6:30 PM,2:12,132,,2,0,8,8,0,0,10,8,6,2,3,2,0,0,,,Yes,Yes,Yes,Yes,5
Default,Sunshine Coast,The Daily Bread,-26.6277779,152.958561,3/25/2020,3/25/2020,4:30 PM,6:30 PM,2:00,120,,0,0,2,10,0,0,10,2,1,0,0,0,0,0,,,Yes,Yes,Yes,Yes,5
Default,Sunshine Coast,The Daily Bread,-26.6277779,152.958561,4/1/2020,5/25/2020,4:29 PM,6:01 PM,1:32,92,Daily Bread team stated really happy with ss team being present!,0,0,3,5,0,1,10,6,8,0,8,5,0,0,Nul,Daily bread team stated they were thankful for Ss caring for their community visitors,Yes,Yes,Yes,Yes,5
Default,Sunshine Coast,The Daily Bread,-26.6277779,152.958561,4/8/2020,4/8/2020,4:15 PM,6:00 PM,1:45,105,First time here for me.  Good friendly bunch  of  people  both volunteers  and  customers. Reportedly  quieter than normal. Has been raining.  Enquiries  re fluvax.  I  wasn't  sure re situation  so  not sure what  to tell them.  ,0,0,1,4,0,1,8,0,0,0,0,1,0,0,,,Yes,Yes,Yes,Yes,5
Default,Sunshine Coast,The Daily Bread,-26.6277779,152.958561,4/15/2020,4/17/2020,4:16 PM,6:00 PM,1:44,104,Quiet afternoon  for me. Chats around fluvax and COVID.   Lots of Volunteers.  They are extending to a Friday  dinner too. So clients happy. Had trouble with this app trying to lodge report. ,0,0,0,4,0,0,7,0,0,0,0,1,0,0,,,Yes,Yes,Yes,Yes,5
Default,Sunshine Coast,The Daily Bread,-26.6277779,152.958561,4/22/2020,4/23/2020,4:17 PM,6:30 PM,2:13,133, Busier tonight. ,0,0,1,3,0,0,7,0,1,0,1,3,0,0,,,Yes,Yes,Yes,Yes,5
Default,Sunshine Coast,The Daily Bread,-26.6277779,152.958561,4/29/2020,4/29/2020,4:15 PM,6:01 PM,1:46,106,Fluvax clinic started.8 given. Numbers still low due to COVID restrictions.  ,8,0,8,2,0,0,12,2,0,0,0,0,0,0,,,Yes,Yes,Yes,Yes,5
Default,Sunshine Coast,The Daily Bread,-26.6277779,152.958561,5/6/2020,5/9/2020,4:23 AM,5:44 AM,1:21,81,Couple more fluvax given. Clinic over and done very quickly.  People just disappeared  ! ,3,0,0,5,0,0,10,0,2,0,0,2,0,0,,0,Yes,Yes,Yes,Yes,5
Default,Sunshine Coast,The Daily Bread,-26.6277779,152.958561,5/20/2020,5/20/2020,4:30 PM,5:49 PM,1:19,79,"Spoke to a person about paying for their bike as they enjoy cycling
Flu shots didn't hurt!!!",0,0,3,2,0,0,9,2,1,0,0,2,0,0,Nul,Nil,Yes,Yes,Yes,Yes,5
Default,Sunshine Coast,The Daily Bread,-26.6277779,152.958561,5/27/2020,5/28/2020,4:15 PM,5:30 PM,1:15,75,Quiet for me but quite a few new (to me) faces. Orange Sky was here,0,0,0,3,0,0,8,0,1,0,0,1,0,0,No,No,Yes,Yes,Yes,Yes,5
Default,Sunshine Coast,The Daily Bread,-26.6277779,152.958561,6/10/2020,6/10/2020,4:19 PM,5:30 PM,1:11,71,Quiet.,0,0,0,1,1,0,4,2,1,0,0,1,0,0,0,0,Yes,Yes,Yes,Yes,5
Default,Sunshine Coast,The Daily Bread,-26.6277779,152.958561,6/24/2020,6/24/2020,4:30 PM,5:37 PM,1:07,67,Need to please find out the code to the new lock now on the cupboard holding the nursing supplies! ðŸ˜Š,0,0,0,0,0,0,13,8,2,0,4,0,0,0,One person said we were beautiful people. ,0,Yes,Yes,Yes,Yes,5
Default,Sunshine Coast,The Daily Bread,-26.6277779,152.958561,8/12/2020,12/16/2020,4:30 PM,6:00 PM,1:30,90,,0,0,4,6,0,2,6,2,7,0,3,3,0,0,Grateful for our team reaching out and listening!,Grateful for our service,Yes,Yes,Yes,Yes,5
Default,Sunshine Coast,The Daily Bread,-26.6277779,152.958561,8/19/2020,10/14/2020,4:30 PM,6:30 PM,2:00,120,,0,0,5,0,0,2,6,2,1,1,1,1,0,0,0,,Yes,Yes,Yes,Yes,5
Default,Sunshine Coast,The Daily Bread,-26.6277779,152.958561,9/2/2020,9/2/2020,4:30 PM,5:25 PM,0:55,55,"Most popular attendance for about 3 months, lots of people speaking to healthcare workers, and we sang Happy Birthday for Aliâ€™s 40th",1,0,1,7,0,3,21,10,11,1,1,2,0,0,"4x thank you so much, you're a legend",None ,Yes,Yes,Yes,Yes,5
Default,Sunshine Coast,The Daily Bread,-26.6277779,152.958561,9/9/2020,9/9/2020,4:30 PM,6:00 PM,1:30,90,"It was a good night, good support from everyone here. Good chats 
Orange Sky lady was pleased to talk about a patient too ",0,0,0,0,0,1,12,6,3,0,0,0,0,0,1 pleased with our referral,Good jobðŸ˜Š,Yes,Yes,Yes,Yes,4
Default,Sunshine Coast,The Daily Bread,-26.6277779,152.958561,9/16/2020,9/16/2020,4:30 PM,6:00 PM,1:30,90,,0,0,3,3,0,1,13,6,3,1,0,1,0,0,Friendly & one patient stated thanks for coming,0,Yes,Yes,Yes,Yes,5
Default,Sunshine Coast,The Daily Bread,-26.6277779,152.958561,9/23/2020,9/23/2020,4:30 PM,6:30 PM,2:00,120,,1,0,1,2,0,2,9,9,1,1,0,1,0,1,Grateful for mental health advice re friend,Orange Sky keen to chat about One person,Yes,Yes,Yes,Yes,5
Default,Sunshine Coast,The Daily Bread,-26.6277779,152.958561,9/30/2020,9/30/2020,4:30 PM,6:15 PM,1:45,105,"A good night lots of chats. We spoke to a couple of women about the womenâ€™s health day coming up. 
Instructed Frances on Telehealth and how to connect with Dr Nova tomorrow night. 
A man arrived at pack up time on the street yelling and swearing. Didnâ€™t come near us but was quite abusive and hence only 4 stars on shift safety ",0,0,0,0,0,0,10,9,0,0,0,1,0,0,Grateful for chats and happy to see us. Getting to know people each week,Orange Sky thought One person was going very well,Yes,Yes,Yes,Yes,4
Default,Sunshine Coast,The Daily Bread,-26.6277779,152.958561,10/7/2020,10/14/2020,4:30 PM,6:30 PM,2:00,120,,0,0,4,0,0,2,2,2,2,0,0,0,0,0,0,,Yes,Yes,Yes,Yes,5
Default,Sunshine Coast,The Daily Bread,-26.6277779,152.958561,10/14/2020,10/14/2020,4:30 PM,6:00 PM,1:30,90,,3,0,1,5,0,2,21,10,2,0,0,2,0,0,Regarding Sonia - was hoping to see her again she was great and very chatty yay Sonia! ,None ,Yes,Yes,Yes,Yes,5
Default,Sunshine Coast,The Daily Bread,-26.6277779,152.958561,10/21/2020,10/21/2020,4:30 PM,5:50 PM,1:20,80,"Last week we were worried about Frances accepting a ride home From John. I checked in with her and everything was all ok. 
Fairly quiet night numbers wise ",0,0,0,0,0,0,11,6,1,0,0,0,0,0,0,Happy to see us here,Yes,Yes,Yes,Yes,5
Default,Sunshine Coast,The Daily Bread,-26.6277779,152.958561,10/28/2020,11/9/2020,4:30 PM,6:00 PM,1:30,90,,0,0,4,4,0,5,4,4,8,0,4,4,0,0,0,0,Yes,Yes,Yes,Yes,5
Default,Sunshine Coast,The Daily Bread,-26.6277779,152.958561,11/4/2020,11/4/2020,4:30 PM,6:00 PM,1:30,90,It was a great night ,0,0,2,2,0,2,4,5,1,1,0,0,0,0,Very appreciative and happy to see what was on offer,Orange Sky very pleased we could help new patient,Yes,Yes,Yes,Yes,5
Default,Sunshine Coast,The Daily Bread,-26.6277779,152.958561,11/11/2020,11/11/2020,4:30 PM,5:50 PM,1:20,80,"Good shift, fairly quiet ",0,0,0,0,0,0,16,18,0,0,0,0,0,0,0,0,Yes,Yes,Yes,Yes,5
Default,Sunshine Coast,The Daily Bread,-26.6277779,152.958561,11/18/2020,11/18/2020,4:30 PM,6:15 PM,1:45,105,Went well :),0,0,0,1,0,0,12,11,1,0,0,0,0,0,0,0,Yes,Yes,Yes,Yes,5
Default,Sunshine Coast,The Daily Bread,-26.6277779,152.958561,11/25/2020,11/25/2020,4:30 PM,6:00 PM,1:30,90,"Excellent night, lots of conversations ",0,0,0,4,0,1,21,6,1,0,1,0,0,0,Super happy and grateful,Very grateful for information we supply them with ,Yes,Yes,Yes,Yes,5
Default,Sunshine Coast,The Daily Bread,-26.6277779,152.958561,12/2/2020,12/2/2020,4:30 PM,6:00 PM,1:30,90,Tracey asked Sophie to talk with St John's school students/volunteers re Sunny Street. ,0,0,0,3,0,0,16,8,1,0,0,0,0,0,0,2,Yes,Yes,Yes,Yes,5
Default,Sunshine Coast,The Daily Bread,-26.6277779,152.958561,12/9/2020,12/9/2020,4:30 PM,6:00 PM,1:30,90,,0,0,0,4,0,0,12,7,0,0,0,0,0,0,0,O,Yes,Yes,Yes,Yes,5
Default,Sunshine Coast,The Daily Bread,-26.6277779,152.958561,12/16/2020,12/16/2020,4:30 PM,6:30 PM,2:00,120,,0,0,0,2,0,1,7,10,1,0,0,0,0,0,Merry Christmas ,Merry Christmas ,Yes,Yes,Yes,Yes,5
Default,Sunshine Coast,The Daily Bread,-26.6277779,152.958561,1/27/2021,1/27/2021,4:30 PM,6:30 PM,2:00,120,"Really really busy. Some major drug use and affected clients who virtually ran when I suggested an ambulance as the man was on parole. 
Another guy Frankie having mental health issues and worried about getting back on drugs. Has lots of issues and I nearly got him to let me call the ambulance but he decided to go with his friend tonight and talk with him. Orange Sky were great and waited with me while I talked with him. No suicide plan

The kitchen has been fairly quiet so are closing early so I have to pack up and canâ€™t enter notes into computer. 

Felt a bit swamped tonight so hope some more volunteers can come next week :)",0,0,1,4,0,4,10,7,2,0,2,0,0,0,4,5,Yes,Yes,Yes,Yes,5
Default,Sunshine Coast,The Daily Bread,-26.6277779,152.958561,2/3/2021,2/3/2021,4:30 PM,7:00 PM,2:30,150,,0,0,5,2,0,0,12,8,1,0,2,2,0,0,0,1,Yes,Yes,Yes,Yes,5
Default,Sunshine Coast,The Daily Bread,-26.6277779,152.958561,2/10/2021,2/10/2021,4:30 PM,6:00 PM,1:30,90,,0,0,4,4,0,4,8,8,0,0,0,2,0,0,0,0,Yes,Yes,Yes,Yes,5
Default,Sunshine Coast,The Daily Bread,-26.6277779,152.958561,2/17/2021,2/17/2021,4:20 PM,5:45 PM,1:25,85,"A lot of new faces , apparently a lot of guys just released from prison. Regulars were quite wary of them ",0,0,0,4,0,1,18,10,0,0,0,0,0,0,Very happy to see us regularly ,"Good vibe, passing on information and sharing ",Yes,Yes,Yes,Yes,5
Default,Sunshine Coast,The Daily Bread,-26.6277779,152.958561,2/24/2021,2/24/2021,4:30 PM,6:00 PM,1:30,90,,0,0,2,1,1,0,12,8,1,0,1,0,0,0,1,1,Yes,Yes,Yes,Yes,5
Default,Sunshine Coast,The Daily Bread,-26.6277779,152.958561,3/10/2021,3/10/2021,4:30 PM,6:00 PM,1:30,90,Extra long extension cord is missing ,0,0,0,4,2,0,14,12,1,0,2,1,0,0,0,Glad we were here,Yes,Yes,Yes,Yes,5
Default,Sunshine Coast,The Daily Bread,-26.6277779,152.958561,3/17/2021,3/17/2021,4:30 PM,6:00 PM,1:30,90,,0,0,1,0,0,0,15,17,1,0,0,0,0,0,0,Orange Sky also concerned TDB is leaving quite early ie 5.30,Yes,Yes,Yes,Yes,5
Default,Sunshine Coast,The Daily Bread,-26.6277779,152.958561,3/24/2021,3/25/2021,4:30 PM,6:00 PM,1:30,90,,0,0,1,3,0,0,15,14,0,0,0,1,0,0,0,Good communication and team work with orange Sky ,Yes,Yes,Yes,Yes,5
Default,Sunshine Coast,The Daily Bread,-26.6277779,152.958561,3/31/2021,3/31/2021,4:30 PM,6:00 PM,1:30,90,,0,0,0,0,2,0,18,17,1,0,0,0,0,0,Love our work,Good work,Yes,Yes,Yes,Yes,5
Default,Sunshine Coast,The Daily Bread,-26.6277779,152.958561,4/7/2021,4/7/2021,4:30 PM,6:30 PM,2:00,120,,0,0,3,6,4,0,14,10,0,0,0,0,0,0,Thank you for your help,Love you work ,Yes,Yes,Yes,Yes,5
Default,Sunshine Coast,The Daily Bread,-26.6277779,152.958561,4/14/2021,4/14/2021,4:30 PM,6:00 PM,1:30,90,"Very well, enjoyed meeting our new RNs 
Called an ambulance for Maxy Herring, off to Nambour. Added notes to his file ",0,0,1,0,0,0,20,22,0,0,0,0,0,0,Happy to see us,Very happy to see us and to have support,Yes,Yes,Yes,Yes,5
Default,Sunshine Coast,The Daily Bread,-26.6277779,152.958561,4/21/2021,4/22/2021,4:30 PM,5:40 PM,1:10,70,OSA volunteers point out to SS people who they think need support. ,0,0,0,4,2,2,12,8,12,0,1,0,0,0,0,Thanked us for the work we do.,Yes,No,No,No,5
Default,Sunshine Coast,The Daily Bread,-26.6277779,152.958561,4/28/2021,4/28/2021,4:30 PM,6:30 PM,2:00,120,,0,0,0,0,1,0,18,19,0,0,0,0,0,0,Love us,Great having us,Yes,Yes,Yes,Yes,5
Default,Fraser Coast ,The Salvation Army Maryborough ,-25.5406534,152.6988674,11/11/2020,1/25/2021,4:00 PM,6:00 PM,2:00,120,,4,0,4,8,0,2,5,2,6,1,4,7,0,0,Really happy to be heard!,Grateful for the SS service,Yes,Yes,Yes,Yes,5
Default,Fraser Coast ,The Salvation Army Maryborough ,-25.5406534,152.6988674,11/18/2020,11/24/2020,4:00 PM,5:30 PM,1:30,90,What a lovely first day! ,1,0,6,3,0,1,6,1,2,0,1,0,0,0,2,,Yes,Yes,Yes,Yes,5
Default,Fraser Coast ,The Salvation Army Maryborough ,-25.5406534,152.6988674,11/25/2020,1/25/2021,4:01 PM,6:00 PM,1:59,119,,3,0,4,8,0,3,4,2,8,1,4,6,0,0,Grateful for our team reaching out and listening!,Grateful for the SS service,Yes,Yes,Yes,Yes,5
Default,Fraser Coast ,The Salvation Army Maryborough ,-25.5406534,152.6988674,12/2/2020,12/3/2020,4:00 PM,5:30 PM,1:30,90,"Good, busy clinic",2,0,9,11,0,3,18,0,9,1,1,3,0,0,0,0,Yes,Yes,No,Yes,5
Default,Fraser Coast ,The Salvation Army Maryborough ,-25.5406534,152.6988674,12/9/2020,12/10/2020,4:00 PM,5:30 PM,1:30,90,"Great to meet Jodi and Karlene, and to see the setup at Maryborough. ",0,0,3,6,0,1,10,5,5,0,3,3,1,3,We are all angels.,0,No,Yes,No,No,5
Default,Fraser Coast ,The Salvation Army Maryborough ,-25.5406534,152.6988674,12/16/2020,1/25/2021,4:00 PM,6:00 PM,2:00,120,,3,0,5,9,0,3,3,2,5,0,3,7,0,0,0,Grateful for the SS service,Yes,Yes,Yes,Yes,5
Default,Fraser Coast ,The Salvation Army Maryborough ,-25.5406534,152.6988674,12/23/2020,12/23/2020,4:00 PM,5:30 PM,1:30,90,,1,0,1,2,0,1,12,1,1,1,0,0,0,1,Angels  we are referred as ðŸ˜Š we received so many thank you today!,0,Yes,Yes,No,Yes,5
Default,Fraser Coast ,The Salvation Army Maryborough ,-25.5406534,152.6988674,1/27/2021,1/27/2021,4:00 PM,5:45 PM,1:45,105,,0,0,5,6,0,4,6,1,2,1,1,2,0,0,Wonderful and helpful ,,Yes,No,No,Yes,5
Default,Fraser Coast ,The Salvation Army Maryborough ,-25.5406534,152.6988674,2/3/2021,2/3/2021,4:00 PM,5:25 PM,1:25,85,,1,0,4,3,0,2,6,3,2,0,2,1,0,1,Very positive comments about the service ,Tom from NDIS said what a wonderful service sunny street offer ðŸ¤©,Yes,Yes,Yes,Yes,5
Default,Fraser Coast ,The Salvation Army Maryborough ,-25.5406534,152.6988674,2/17/2021,2/18/2021,4:00 PM,5:30 PM,1:30,90,,0,0,3,4,0,3,5,0,2,0,0,1,0,0,Thank you â˜ºï¸ ,,Yes,Yes,No,Yes,5
Default,Fraser Coast ,The Salvation Army Maryborough ,-25.5406534,152.6988674,2/24/2021,2/24/2021,4:00 PM,5:30 PM,1:30,90,,0,0,5,5,1,5,7,1,2,0,1,1,2,0,Positive ðŸ˜,,Yes,Yes,No,Yes,5
Default,Fraser Coast ,The Salvation Army Maryborough ,-25.5406534,152.6988674,3/3/2021,3/4/2021,4:05 PM,5:50 PM,1:45,105,,1,0,4,7,0,3,8,4,6,1,3,6,2,1,We are angels!,0,Yes,Yes,No,Yes,4
Default,Fraser Coast ,The Salvation Army Maryborough ,-25.5406534,152.6988674,3/10/2021,3/10/2021,4:10 PM,5:30 PM,1:20,80,A few agitated people that walked out - otherwise good,3,0,4,4,0,2,6,0,1,1,0,1,0,0,Positive ,,Yes,Yes,No,Yes,4
Default,Fraser Coast ,The Salvation Army Maryborough ,-25.5406534,152.6988674,3/17/2021,3/18/2021,4:00 PM,5:30 PM,1:30,90,"No volunteers available for shift. Nova's mobile number given to Dianne, in the event that a patient/s needed to speak with Nova.",0,0,0,0,0,0,0,0,0,0,0,0,0,0,0,0,No,No,No,No,5
Default,Fraser Coast ,The Salvation Army Maryborough ,-25.5406534,152.6988674,3/24/2021,3/25/2021,4:00 PM,5:30 PM,1:30,90,NO staff to cover shift,0,0,0,0,0,0,0,0,0,0,0,0,0,0,0,0,No,No,No,No,5
Default,Fraser Coast ,The Salvation Army Maryborough ,-25.5406534,152.6988674,4/14/2021,4/19/2021,4:00 PM,5:30 PM,1:30,90,,0,0,1,4,0,2,5,0,1,0,1,1,1,0,Angels ðŸ’•,,Yes,Yes,No,Yes,5
Default,Fraser Coast ,The Salvation Army Maryborough ,-25.5406534,152.6988674,4/21/2021,4/21/2021,4:00 PM,5:30 PM,1:30,90,,0,0,0,3,0,5,6,0,2,1,1,0,0,0,Good,,Yes,Yes,No,Yes,5
Default,Fraser Coast ,The Salvation Army Maryborough ,-25.5406534,152.6988674,4/28/2021,4/28/2021,4:00 PM,5:30 PM,1:30,90,,0,0,3,9,2,4,4,2,2,1,2,2,0,0,Wonderful support,,Yes,Yes,No,Yes,4
Default,Sunshine Coast,The Shack,-26.6245779,152.9558023,8/19/2019,8/19/2019,9:00 AM,10:40 AM,1:40,100,,2,0,1,0,0,2,2,0,0,0,0,0,0,0,,,Yes,No,Yes,No,5
Default,Sunshine Coast,The Shack,-26.6245779,152.9558023,8/26/2019,8/26/2019,9:00 AM,11:25 AM,2:25,145,"Nurses Kit needs dressing trays, large Melonin dressings ",6,0,2,0,0,2,4,0,0,0,0,0,0,0,,,Yes,Yes,Yes,No,5
Default,Sunshine Coast,The Shack,-26.6245779,152.9558023,9/9/2019,9/9/2019,9:05 AM,11:01 AM,1:56,116,"Quiet clinic, plenty of conversations outside the consulting rooms. Nursing kit needs restock",0,0,3,0,0,1,11,0,0,0,0,0,0,0,,,Yes,Yes,No,No,5
Default,Sunshine Coast,The Shack,-26.6245779,152.9558023,9/16/2019,9/16/2019,9:09 AM,11:00 AM,1:51,111,"Smooth clinic, a new patient & new to homelessness",0,0,4,0,0,3,15,0,0,0,0,0,0,0,,,Yes,No,No,No,5
Default,Sunshine Coast,The Shack,-26.6245779,152.9558023,9/23/2019,9/23/2019,9:05 AM,10:20 AM,1:15,75,"Nursing kit needs gauze squares, betadine swabs & scissors
Consider disposable suture kits",3,0,5,0,0,3,5,0,0,0,0,0,0,0,,,Yes,Yes,No,No,5
Default,Sunshine Coast,The Shack,-26.6245779,152.9558023,9/30/2019,9/30/2019,9:00 AM,10:38 AM,1:38,98,Short clinic this morning due to Shack closing earlier. Two regular patients & one new one patient. Shack will be closed all next week. ,0,0,3,0,0,1,3,0,0,0,0,0,0,0,,,No,Yes,No,No,5
Default,Sunshine Coast,The Shack,-26.6245779,152.9558023,10/14/2019,10/14/2019,9:00 AM,11:01 AM,2:01,121,People attending the Shack talking about the passing of Dale RIP,0,0,4,0,0,3,11,0,0,0,0,0,0,0,,,Yes,Yes,No,Yes,5
Default,Sunshine Coast,The Shack,-26.6245779,152.9558023,10/21/2019,10/21/2019,9:00 AM,11:00 AM,2:00,120,Quiet clinic. The Shack quiet generally,0,0,2,0,0,1,14,0,0,0,0,0,0,0,,,Yes,Yes,No,No,5
Default,Sunshine Coast,The Shack,-26.6245779,152.9558023,10/28/2019,10/28/2019,9:00 AM,11:00 AM,2:00,120,Nursing kit needs splinter removal also betadine swabs. Surface wipes. Quiet at Shack but clinic constant.,0,0,6,0,0,5,14,0,0,0,0,0,0,0,,,Yes,Yes,No,No,5
Default,Sunshine Coast,The Shack,-26.6245779,152.9558023,11/4/2019,11/4/2019,9:00 AM,11:00 AM,2:00,120,Quite a few new attendances for the Shack. New client conversation for clinic,0,0,0,0,0,0,5,0,0,5,0,0,0,0,,,No,No,No,Yes,4
Default,Sunshine Coast,The Shack,-26.6245779,152.9558023,11/11/2019,11/11/2019,9:00 AM,11:00 AM,2:00,120,Busy start to shift. Some new clients.,0,0,0,0,0,0,11,0,0,1,0,0,0,0,,,Yes,Yes,No,No,4
Default,Sunshine Coast,The Shack,-26.6245779,152.9558023,11/18/2019,11/18/2019,9:00 AM,11:00 AM,2:00,120,Very quiet shift for us and also The Shack,0,0,0,0,0,0,3,0,0,3,0,0,0,0,,,No,Yes,No,No,0
Default,Sunshine Coast,The Shack,-26.6245779,152.9558023,11/25/2019,11/25/2019,9:00 AM,11:00 AM,2:00,120,Shift moderate activity. ,0,0,0,0,0,0,8,0,0,0,0,1,0,0,,,Yes,Yes,No,Yes,3
Default,Sunshine Coast,The Shack,-26.6245779,152.9558023,12/2/2019,12/2/2019,9:00 AM,11:15 AM,2:15,135,A lot of new clients at the Shack. ,0,0,0,0,0,0,9,0,0,9,0,0,0,0,,,Yes,Yes,No,Yes,4
Default,Sunshine Coast,The Shack,-26.6245779,152.9558023,12/9/2019,12/12/2019,9:00 AM,11:45 AM,2:45,165,Busy clinic grateful for session_reportss presemcr,0,0,0,0,0,2,11,0,0,0,0,0,0,0,,,Yes,Yes,No,Yes,4
Default,Sunshine Coast,The Shack,-26.6245779,152.9558023,12/16/2019,12/16/2019,9:00 AM,10:30 AM,1:30,90,Well attended clinic,0,0,2,0,0,0,6,0,0,0,0,0,0,0,,,Yes,Yes,No,Yes,4
Default,Sunshine Coast,The Shack,-26.6245779,152.9558023,1/13/2020,1/13/2020,9:00 AM,10:54 AM,1:54,114,No clinics for the next 2 Monday's ,0,0,2,0,0,2,1,2,1,0,0,1,0,0,,,Yes,No,No,Yes,5
Default,Sunshine Coast,The Shack,-26.6245779,152.9558023,2/3/2020,2/3/2020,9:00 AM,10:34 AM,1:34,94,"Buddied 2 new people!
Quiet day",0,0,5,8,0,5,11,8,6,1,0,1,0,0,,,Yes,Yes,Yes,Yes,5
Default,Sunshine Coast,The Shack,-26.6245779,152.9558023,2/10/2020,2/10/2020,9:01 AM,11:01 AM,2:00,120,Good day. ,0,0,0,1,0,1,3,0,0,0,0,0,0,0,,,No,No,No,Yes,4
Default,Sunshine Coast,The Shack,-26.6245779,152.9558023,2/17/2020,2/17/2020,9:00 AM,11:00 AM,2:00,120,,0,0,1,0,0,0,5,0,0,0,0,1,0,0,,,Yes,Yes,No,Yes,4
Default,Sunshine Coast,The Shack,-26.6245779,152.9558023,2/24/2020,2/24/2020,9:00 AM,11:23 AM,2:23,143,,3,0,0,0,0,0,7,0,0,0,0,0,0,0,,,Yes,Yes,No,Yes,4
Default,Sunshine Coast,The Shack,-26.6245779,152.9558023,3/2/2020,3/2/2020,9:01 AM,11:02 AM,2:01,121,Good shuft,0,1,2,2,0,1,12,0,0,0,0,1,0,0,,,Yes,Yes,No,Yes,4
Default,Sunshine Coast,The Shack,-26.6245779,152.9558023,3/9/2020,3/11/2020,9:30 AM,10:30 AM,1:00,60,Incident report filed from QAS,0,0,3,0,0,1,5,0,0,0,0,0,0,0,,,Yes,Yes,Yes,Yes,5
Default,Sunshine Coast,The Shack,-26.6245779,152.9558023,3/23/2020,3/26/2020,7:00 AM,8:00 AM,1:00,60,,0,0,0,14,0,0,14,0,0,0,0,0,0,0,,,Yes,Yes,No,Yes,5
Default,Sunshine Coast,The Shack,-26.6245779,152.9558023,3/30/2020,3/30/2020,7:00 AM,8:00 AM,1:00,60,Renovations well underway at the Shack - staff juggling social distancing as per COVID-19 guidelines,0,10,0,10,0,0,10,2,2,0,3,1,0,0,,,Yes,No,No,Yes,5
Default,Sunshine Coast,The Shack,-26.6245779,152.9558023,4/6/2020,4/15/2020,7:00 AM,8:00 AM,1:00,60,,0,0,2,18,0,0,18,1,18,0,0,0,0,0,,,Yes,Yes,No,No,5
Default,Sunshine Coast,The Shack,-26.6245779,152.9558023,4/20/2020,4/20/2020,7:00 AM,8:00 AM,1:00,60,,2,0,9,11,0,2,11,2,11,0,0,2,0,0,,,Yes,No,No,Yes,5
Default,Sunshine Coast,The Shack,-26.6245779,152.9558023,4/27/2020,4/27/2020,7:00 AM,8:00 AM,1:00,60,"Loo is unable to enter a shift report. TW will go to The Shack on Friday, to see why Loo can't enter a shift report on CF. Need thermometer covers.",0,0,12,2,0,2,10,1,12,0,0,0,0,0,,,Yes,Yes,No,Yes,5
Default,Sunshine Coast,The Shack,-26.6245779,152.9558023,5/4/2020,5/25/2020,7:01 AM,8:01 AM,1:00,60,"Social distancing in place.
Flu clinic time!",8,0,10,18,0,6,21,12,25,2,10,15,0,0,Nul,One person said he was grateful as was at the shack to care for everyone!,Yes,Yes,Yes,Yes,5
Default,Sunshine Coast,The Shack,-26.6245779,152.9558023,5/18/2020,5/18/2020,7:00 AM,8:00 AM,1:00,60,A bit damp outside today! Hoping to be back in The Shack building soon!,0,0,9,9,0,0,9,1,5,0,0,1,6,0,,"One person was a disappointed that flu vaccines were not done, as he had 6 patients waiting, who were turned away.",Yes,No,No,Yes,5
Default,Sunshine Coast,The Shack,-26.6245779,152.9558023,5/25/2020,5/25/2020,7:00 AM,8:25 AM,1:25,85,New attendee becoming more comfortable with Sunny Street service staying longer/communicating more,3,0,3,6,0,0,14,9,4,0,3,3,0,0,0,0,Yes,Yes,Yes,Yes,5
